company_slug,company_name,founder_name,role,background,origin,status
rain-ai,Rain Ai,Jack Kendall,Co-Founder & CTO,"Attended University of Florida. Worked at University of Florida as part of the Nino Research Group. Left Meta to become Lead Physical researcher. Inventor and interdisciplinary researcher with interests in physics, neuroscience, and computing. Devoted past 10+ years to understanding how the brain works. Research focuses on deep learning, neuroscience, materials science, circuit and network theory. Working to close the 1,000,000x efficiency gap between human brains and current processors.",American,
rain-ai,Rain Ai,Juan Claudio Nino,Co-Founder,Professor at University of Florida leading the Nino Research Group focused on materials science and computational physics. Academic researcher whose lab work on neuromorphic materials provided foundational science for Rain AI's chip design. Co-founded Rain Neuromorphics in 2017.,Hispanic-American,
raindrop,Raindrop,Zubin Koticha,Co-Founder & CEO,Second-time founder; previous company acquired by Coinbase,Indian-American,
raindrop,Raindrop,Alexis Gauba,Co-Founder,Second-time founder; previous company acquired by Coinbase,Indian-American,
raindrop,Raindrop,Ben Hylak,Co-Founder,Former engineer at Apple; 4 years on Apple Human Interface Design team,American,
raspberry-ai,Raspberry Ai,Cheryl Liu,Founder & CEO,Former private equity analyst at KKR (retail focus); worked at Amazon and DoorDash,Chinese-American,
ravenna-ai,Ravenna Ai,Taylor Halliday,Co-Founder,Former Director of Engineering and AI at Zapier. YC 2016 alum (Mesh Studio).,American,
ravenna-ai,Ravenna Ai,Kevin Coleman,Co-Founder,Former go-to-market lead at AWS (4 years). YC 2016 alum (Mesh Studio).,American,
ray-security,Ray Security,Ariel Zamir,Co-Founder & CEO,"Israeli cybersecurity veteran; experience at NetApp, Check Point, Guardicore, Axonius",Israeli,
ray-security,Ray Security,Eric Wolf,Co-Founder & CBO,Enterprise security background,Israeli,
ray-security,Ray Security,Dekel Levkovich,Co-Founder & CTO,Enterprise security background,Israeli,
realroots,Realroots,Dorothy Li,Co-Founder,YC S25 batch.,Chinese-American,
realroots,Realroots,Tara Kappel,Co-Founder,YC S25 batch.,,
rebellion-defense,Rebellion Defense,Chris Lynch,Co-founder,"Serial entrepreneur from Seattle. Attended University of Cincinnati Carl H. Lindner College of Business. Hired by SecDef Ash Carter in 2015 to found the Defense Digital Service (DDS), a Pentagon ""SWAT team of hackers"" that ran bug bounty programs and helped launch the JEDI cloud program. Left DDS in April 2019 to found Rebellion Defense. Previously founded venture-backed startups and led engineering teams at enterprise companies.",American,
rebellion-defense,Rebellion Defense,Nicole Camarillo,Co-founder,"Spent 20 years as a Federal employee supporting Department of the Navy, Department of Defense, and DISA. Served as Chief Strategist for U.S. Army Cyber Command. At Rebellion Defense, served as Chief Talent and Operations Officer.",American,
rebellion-defense,Rebellion Defense,Oliver Lewis,Co-founder,"Former Deputy Director of the Digital, Data and Technology profession in the British civil service. UK Ministry of Defence intelligence officer, policy advisor, and strategy advisor with two deployments to Afghanistan as a civilian intelligence officer embedded in the British Army. Started government business for metaverse technology unicorn Improbable. Affiliated with University of Oxford's Changing Character of War Centre for a decade. Non-resident senior visiting fellow at USC Center on Public Diplomacy.",British,
rebellion-defense,Rebellion Defense,Chase Kimball,Co-founder,"Details limited in public sources. Co-founded Rebellion Defense in 2019 alongside Lynch, Camarillo, and Lewis.",American,
rebellions,Rebellions,Sunghyun Park,Founder & CEO,"MIT graduate in EE and CS; former Senior Research Scientist at Intel Labs, Staff Engineer at Samsung, Starlink ASIC Design Engineer at SpaceX, VP at Morgan Stanley",Korean,
recall-ai,Recall Ai,David Gu,Co-Founder & CEO,Bachelor of Software Engineering from University of Waterloo. Previously Software Engineer at Wish (2019). Y Combinator W20 alum. Built Perfect Recall (general-purpose AI meeting assistant) before pivoting to Recall.ai after discovering the infrastructure needed for conversational AI applications was incredibly difficult to build.,Chinese-Canadian,
recall-ai,Recall Ai,Amanda Zhu,Co-Founder & COO,Attended University of Waterloo. Co-built Perfect Recall with David Gu before pivoting to Recall.ai. Described as technically gifted and tenacious. Handles operations and business side of Recall.ai.,Chinese-Canadian,
recraft-ai,Recraft Ai,Anna Veronika Dorogush,Founder & CEO,"MSc in Applied Mathematics and Computer Science from Lomonosov Moscow State University (2005-2010). Yandex School of Data Analysis graduate. Career includes Software Engineer at ABBYY (morphology/spellchecking), Software Engineer at Microsoft (2012-2013), Software Engineer at Google NLP group (2014, automatic fact translation and knowledge graph), and IC/Head of ML Tools at Yandex (2016+). Creator of CatBoost, the widely-used open-source gradient boosting library (hundreds of thousands of weekly PyPI downloads). Director of ML Engineering at Next Iteration Technologies. Solo female founder in AI image generation, previously worked as a professional model while studying mathematics.",Russian,
recursion,Recursion,Chris Gibson,Co-Founder & Board Chair,PhD; developed Recursion's core technology during graduate work at University of Utah; Rice University degrees in bioengineering and management; former CEO 2013-2025,American,
reflection-ai,Reflection Ai,Misha Laskin,CEO & Co-Founder,"BA Physics and Literature from Yale. PhD in theoretical many-body quantum physics from University of Chicago. After PhD, founded an inventory prediction company. Inspired by AlphaGo paper, pivoted to AI research. Postdoc at UC Berkeley working on reinforcement learning. Senior Research Scientist at Google DeepMind where he led reward modeling efforts for the Gemini project. Made key contributions in reinforcement learning across Berkeley and DeepMind.",Russian-Canadian,
reflection-ai,Reflection Ai,Ioannis Antonoglou,Co-founder,"Long-tenured researcher at Google DeepMind. Made significant contributions to AlphaGo, AlphaZero, and the Gemini project. Deep expertise in reinforcement learning and game-playing AI systems. Co-founded Reflection AI with Laskin to pursue research on superintelligent systems capable of autonomous action.",Greek,
regie-ai,Regie Ai,Srinath Sridhar,Co-Founder & CEO,PhD CS from Carnegie Mellon (Algorithms & ML); early 100-person engineering team at Facebook; founding engineer at BloomReach; designed Google web search ranking algorithms,Indian,
regie-ai,Regie Ai,Matt Millen,Co-Founder,,American,
reka-ai,Reka Ai,Dani Yogatama,CEO & Co-Founder,"PhD in Computer Science from Carnegie Mellon University. Monbukagakusho fellow at the University of Tokyo (2008-2010). Previously a research scientist at DeepMind in London for several years, where he worked on projects including AlphaCode and Bard.",American,
reka-ai,Reka Ai,Yi Tay,Co-Founder & former Chief Scientist (departed Nov 2024),"NTU Singapore alumnus. Senior research scientist at Google Brain. Co-led PaLM-2 (the model behind Bard/Gemini). Invented UL2 (universal pretraining) and Differentiable Search Indexes. His work was integrated into Google Assistant, YouTube, and Search. At Reka, led the effort to build a GPT-4-class multimodal model from scratch in under a year with ~20 engineers.",Singaporean. Lives in Singapore with his family,
reka-ai,Reka Ai,Cyprien de Masson d'Autume,Co-Founder & CTO,Previously a researcher at DeepMind. Technical lead of the company's model development.,French,
reka-ai,Reka Ai,Mikel Artetxe,Co-Founder,Previously a Research Scientist at Meta FAIR (Facebook AI Research). Attended the University of the Basque Country (Universidad del Pais Vasco).,Basque/Spanish,
reka-ai,Reka Ai,Qi Liu,Co-Founder,Previously at DeepMind. Limited public biographical detail available.,Chinese,
remy-ai,Remy Ai,Unknown,Co-Founder & CEO,Robotics and warehouse automation background.,,
replicate,Replicate,Ben Firshman,Co-founder & CEO,Creator of Docker Compose; former Director of Product Management at Docker; 4x founder,British,
replicate,Replicate,Andreas Jansson,Co-founder & CTO,Former Staff ML Engineer at Spotify (2014-2019); PhD in ML for music,Swedish,
replit,Replit,Amjad Masad,CEO & Co-Founder,"Born and raised in Amman, Jordan, with Palestinian heritage. BSc Computer Science from Princess Sumaya University for Technology (Jordan, 2005-2010). Founding engineer at Codecademy (2011-2013). Software engineer and tech lead on JavaScript infrastructure team at Facebook (2013-2016). Created JSRepl in 2011, the open-source precursor to Replit. Turned down a $1B acquisition offer in 2019. YC W18.",Jordanian-American,
replit,Replit,Faris Masad,Co-Founder,Amjad's brother; Jordanian programmer. Specific role details limited in public sources.,Jordanian-American,
replit,Replit,Haya Odeh,Co-Founder (Design),Amjad's wife. Focused on user-friendly design to make the platform accessible to non-developers and professionals. Detailed background not well-documented publicly.,Palestinian-American,
rerun,Rerun,Nikolaus West,Co-Founder & CEO,Second-time founder; software engineer with computer vision background from Stanford,German,
rerun,Rerun,Emil Ernerfeldt,Co-Founder & CTO,"Creator of egui, the biggest open source GUI framework in Rust",Swedish,
rerun,Rerun,Moritz Schiebold,Co-Founder & COO,Led 3D scanning company Volumental as CEO from pre-product to global market leader,German,
resemble-ai,Resemble Ai,Zohaib Ahmed,Co-Founder & CEO,"Computer Science degree from University of Toronto. Led engineering teams at Magic Leap, Deepen AI, Hipmunk (acquired), and BlackBerry. At Hipmunk, was lead engineer of first AI Assistant for Travel built using modern NLP. At Magic Leap, worked on novel UI interactions and deep learning models from user data analysis. Founded Resemble AI with former roommate Saqib Muhammad after identifying opportunity in AI-generated voices for media production.",Canadian (Pakistani heritage),
resemble-ai,Resemble Ai,Saqib Muhammad,Co-Founder,"Bachelor of Commerce from McMaster University; degree from University of Chicago Booth School of Business. Previous experience in finance at Pantera Capital, Passport Capital, Contrarian Capital Management, and Breton Hill Capital. Former roommate and fellow gamer with Zohaib Ahmed. Brings finance and investment expertise to the AI voice synthesis space. Based in Menlo Park, CA.",Canadian (Pakistani heritage),
resolve,Resolve,Spiros Xanthos,Co-Founder & CEO,Co-creator of OpenTelemetry. Founded Omnition (acquired by Splunk 2019). Former GM & SVP of Splunk Observability. MS from University of Illinois Urbana-Champaign.,,
resolve,Resolve,Mayank Agarwal,Co-Founder & CTO,Co-creator of OpenTelemetry. Former Chief Architect of Splunk Observability. MS from University of Illinois Urbana-Champaign. Met Spiros in grad school 20+ years ago.,Indian-American,
revise-robotics,Revise Robotics,Rupesh Jeyaram,CEO,Caltech BS 2020; Wharton MBA 2024,Indian,
revise-robotics,Revise Robotics,Antonio Monreal,CTO,Caltech BS in Electrical Engineering (2016-2020); self-taught English and calculus on a refurbished laptop; full ride to Caltech,Mexico,
revisiondojo,Revisiondojo,Bowen Liu,CEO,Founded RevisionDojo.,,
revisiondojo,Revisiondojo,Janet Liu,COO,BSc Finance LSE. Master's Asset Management (Financial Mathematics) Yale.,,
revisiondojo,Revisiondojo,Michael Tong,CTO,Computer Science at Stanford.,,
rhino-federated,Rhino Federated,Ittai Dayan,Co-Founder & CEO,Medical background,Israeli,
rhino-federated,Rhino Federated,Yuval Baror,Co-Founder & CTO,Experienced AI entrepreneur,Israeli,
rhoda-ai,Rhoda Ai,Jagdeep Singh,Co-Founder & CEO,Serial deep-tech founder; former CEO of QuantumScape (solid-state battery pioneer),Indian-American,
rhoda-ai,Rhoda Ai,Eric Ryan Chan,Co-Founder & CSO,Stanford researcher; leader in computer vision and generative modeling; former generative model architect at WorldLabs,American,
rhoda-ai,Rhoda Ai,Gordon Wetzstein,Co-Founder,Professor at Stanford University; head of Computational Imaging Lab,German-American,
ricursive-intelligence,Ricursive Intelligence,Anna Goldie,CEO,MIT BS CS + MEng. Stanford NLP PhD. Co-led Google AlphaChip (Nature). Early Anthropic employee.,American,
ricursive-intelligence,Ricursive Intelligence,Azalia Mirhoseini,CTO,PhD Rice. Stanford professor. Co-led AlphaChip. Co-authored foundational MoE paper powering GPT-4/Gemini.,Iranian-American,
risely-ai,Risely Ai,Shahryar Abbasi,Co-Founder,YC S25 batch.,Pakistani (inferred from name),
risely-ai,Risely Ai,Danial Asif,Co-Founder,YC S25 batch.,Pakistani (inferred from name),
risely-ai,Risely Ai,Sadia Saifuddin,Co-Founder,YC S25 batch.,Pakistani (inferred from name),
riverline-ai,Riverline Ai,Ankit Sanghvi,CEO,IIT Madras (2023) and Carnegie Mellon University (2024). Research Programmer at CMU. Co-founded Coursepanel (AI-driven course selection platform at IIT Madras). Joined early YC-backed teams as a student. Moved to Bay Area for master's at CMU where he focused on AI. Previously did standup comedy and worked on racecars as a freshman at IIT.,Indian,
riverline-ai,Riverline Ai,Jayanth Krishnaprakash,Co-founder,"Co-founded Riverline AI with Ankit Sanghvi and Abhishek Gupta. Based in Bengaluru, India. Details on prior career limited in public sources.",Indian,
roboflow,Roboflow,Joseph Nelson,Co-Founder & CEO,"BS Economics from George Washington University; studied at London School of Economics. Co-founded Represently (civic-tech NLP platform connecting Congress with constituents), acquired by Fireside21. Principal Data Scientist at ROC AUC consulting for Fortune 500 companies. Wrote and taught 2000+ hours of data science curriculum at General Assembly. Data/Product intern at Meta (government and politics team). Led logic/debate workshops at France's Ecole de guerre.",American,
roboflow,Roboflow,Brad Dwyer,Co-Founder & CTO,"Attended Iowa State University (2006-2014). Founded and ran Hatchlings as CEO from 2008 to 2018 (10 years). Based in San Francisco. Co-founded Roboflow in 2019 with Nelson, driven by the conviction that every developer should have computer vision in their toolkit.",American,
roboforce,Roboforce,Leo Ma,Co-Founder & CEO,MS in Computer Science from Carnegie Mellon; Executive Education at Wharton; 15 years in AI robotics,Chinese-American,
roboforce,Roboforce,Calvin Zhou,Co-Founder & VP of Engineering,,Chinese-American,
robot-era,Robot Era,Chen Jianyu,CEO,"Tsinghua assistant professor, PhD UC Berkeley. Tsinghua University holds shares.",Chinese,
robust-intelligence,Robust Intelligence,Yaron Singer,CEO & Co-Founder,Tenured Professor of Computer Science & Applied Mathematics at Harvard (Gordon McKay Professor). Israeli-born. PhD from UC Berkeley. Previously researcher at Google AI and consulting researcher at Microsoft. Now VP of AI & Engineering at Cisco Security / Foundation AI.,Israeli-American,
robust-intelligence,Robust Intelligence,Kojin Oshiba,Co-Founder,BA in Computer Science & Statistics from Harvard. Grew up in Japan. Previously ML engineer at QuantCo; co-founded its Japan branch. Published at ICML and NeurIPS. Forbes 30 Under 30 in Enterprise Technology (2024). Now leads AI organization at Cisco post-acquisition.,Japanese-American,
rowflow,Rowflow,Jack Bubes,Co-Founder,YC S25 batch.,,
rowflow,Rowflow,Alec Olesky,Co-Founder,YC S25 batch.,,
rubric,Rubric,Unknown,Co-Founder & CEO,ML research and post-training background.,,
rune,Rune,David Tuttle,Co-Founder & CEO,Former U.S. Army officer. Anduril Industries alumnus. Deep experience in military operations and logistics.,American,
rune,Rune,Peter Goldsborough,Co-Founder & CTO,Former Meta engineer. Anduril Industries alumnus. Strong AI/ML engineering background.,American,
runpod,Runpod,Zhen Lu,Co-Founder & CEO,"BSc Chemistry from University of Pittsburgh. Assistant Professor at University of Pittsburgh (2015-2017). Joined Comcast in 2017, progressing from Software Engineer 3 to Software Engineer 4 to Software Engineering Manager (2017-2022). Co-founded RunPod in late 2021 by converting Ethereum mining rigs in his New Jersey basement into AI servers before ChatGPT launched.",Chinese-American,
runpod,Runpod,Pardeep Singh,Co-Founder & CTO,"Over a decade of software engineering experience. Senior Software Engineer at Comcast where he met Zhen Lu. Fascinated with coding since high school, paid for college with a free music app focused on YouTube playlists. Co-founded RunPod by converting Ethereum mining rigs into GPU cloud servers from his New Jersey basement. Built the technical infrastructure for RunPod's globally distributed GPU cloud platform.",Indian-American,
runsybil,Runsybil,Ari Herbert-Voss,Co-Founder,Joined OpenAI in 2019 as its first security research hire. Unique intersection of frontier AI development and offensive security.,American,
runsybil,Runsybil,Vlad Ionescu,Co-Founder,Previously led offensive security red teams at Meta. Expert in penetration testing and vulnerability discovery.,Romanian-American,
runware,Runware,Flaviu Radulescu,Co-Founder & CEO,20+ years experience in big data and cloud platforms,Romanian,
runware,Runware,Ioana Hreninciuc,Co-Founder & COO,Operations and GTM focus,Romanian,
runway,Runway,Cristobal Valenzuela,CEO & Co-Founder,"BA/MA from Adolfo Ibañez University (Chile), MFA from NYU Tisch ITP. Previously adjunct professor at Adolfo Ibañez.",Chilean,
runway,Runway,Anastasis Germanidis,CTO & Co-Founder,NYU Tisch ITP. Background in digital art and generative AI.,Greek,
runway,Runway,Alejandro Matamala,Chief Innovation Officer & Co-Founder,NYU Tisch ITP. Background blending art and technology.,Chilean,
sakana-ai,Sakana Ai,David Ha,CEO,PhD Computer Science (UBC); former Research Scientist at Google Brain (Japan); former Head of Research at Stability AI (2022-2023); earlier career in finance as Co-Head of Fixed Income Trading at Goldman Sachs Japan,Japanese-Canadian,
sakana-ai,Sakana Ai,Llion Jones,CTO,"MSc Advanced Computer Science, University of Birmingham; co-author of 'Attention Is All You Need' (2017), the foundational Transformer paper; ~12 years at Google before departing to co-found Sakana AI",Welsh-British,
sakana-ai,Sakana Ai,Ren Ito,COO,"Former Japanese diplomat (15 years); speechwriter for PM Shinzo Abe; Japan representative at World Bank board; early employee at Mercari (Japan's first unicorn), CEO of Mercari Europe through $3.7B IPO",Japanese,
salt-ai,Salt Ai,Aber Whitcomb,CEO & Co-Founder,Former CTO of MySpace.,American,
salt-ai,Salt Ai,Chris DeWolfe,Co-Founder,Co-founder and former CEO of MySpace.,American,
salt-ai,Salt Ai,Jim Benedetto,CTO & Co-Founder,Founder of Gravity Forms.,American,
salus-ai,Salus Ai,Unknown,Co-Founder & CEO,AI safety and software engineering background.,,
samaya-ai,Samaya Ai,Maithra Raghu,CEO,Ex-Google Brain. PhD CS Cornell. Medical AI research.,Indian-American,
samaya-ai,Samaya Ai,Fabio Petroni,CTO,Ex-Meta AI (FAIR). Knowledge-intensive NLP.,Italian,
sambanova,Sambanova,Rodrigo Liang,CEO,"20+ years in semiconductor engineering at Sun Microsystems and Oracle; BS/MS EE from Stanford; born in Taipei, grew up in Brazil",Taiwanese-Brazilian,
sambanova,Sambanova,Kunle Olukotun,Co-Founder & Chief Technologist,Stanford Professor of EE and CS; pioneer of multicore processors; founded Afara Websystems (acquired by Sun for ~$62M); PhD from Michigan,Nigerian,
sambanova,Sambanova,Christopher Re,Co-Founder,"Stanford Professor of CS; MacArthur Fellow; co-founded Snorkel AI (unicorn); two companies acquired by Apple (Lattice/DeepDive 2017, Inductiv/HoloClean 2020)",American,
sana-labs,Sana Labs,Joel Hellermark,CEO & Founder,Self-taught engineer from Sweden. Started first AI company as teenager. Appointed AI-specialist by Swedish government. Obama Foundation Leader.,Swedish,
sanctuary-ai,Sanctuary Ai,Geordie Rose,Co-Founder & former CEO (departed Nov 2024),PhD Theoretical Physics (UBC); founded D-Wave Systems (world's first quantum computing company); CEO of Kindred Systems (first RL-based production robotics company),Canadian,
sanctuary-ai,Sanctuary Ai,Suzanne Gildert,Co-Founder & former CTO (departed Apr 2024),Pioneered Sanctuary's AI-robotics approach; left to pursue stealth AI project,British-Canadian,
sanctuary-ai,Sanctuary Ai,Ajay Agrawal,Co-Founder,Professor at University of Toronto Rotman School of Management; AI economics researcher,Indian-Canadian,
sanctuary-ai,Sanctuary Ai,Olivia Norton,Co-Founder & CPTO,Chief Product & Technology Officer,American,
sandbar,Sandbar,Mina Fahmi,CEO,Ex-Meta engineer,Egyptian-American,
sandbar,Sandbar,Kirak Hong,Co-founder,Ex-Meta engineer,Korean,
sandboxaq,Sandboxaq,Jack Hidary,CEO,"Former Google X, author of Quantum Computing textbook",American,
saronic-technologies,Saronic Technologies,Dino Mavrookas,Co-Founder & CEO,"Serial entrepreneur in defense and maritime technology. Previously founded and led several technology ventures. Leads Saronic's strategy, product, and government relations.",American,
saronic-technologies,Saronic Technologies,Vibhav Altekar,Co-Founder,Technical co-founder with expertise in autonomous systems and robotics. Background in engineering autonomous platforms.,Indian American,
saronic-technologies,Saronic Technologies,Doug Lambert,Co-Founder,Co-founder with background in defense technology and autonomous systems development.,American,
saronic-technologies,Saronic Technologies,Robert Lehman,Co-Founder,Co-founder contributing to Saronic's autonomous vessel technology and maritime systems.,American,
sarvam-ai,Sarvam Ai,Vivek Raghavan,Co-founder,Former Chief Product Manager and Biometric Architect at UIDAI (Aadhaar); key role in scaling India's biometric ID system,Indian,
sarvam-ai,Sarvam Ai,Pratyush Kumar,Co-founder,"Adjunct faculty at IIT Madras; co-founded AI4Bharat, open-source initiative for AI in Indian languages",Indian,
scale-ai,Scale Ai,Alexandr Wang,Co-founder & former CEO (departed June 2025 to Meta),"Born 1997 in Los Alamos, NM to Chinese immigrant parents who were physicists at Los Alamos National Laboratory. Math and coding prodigy. Attended MIT briefly, worked at Quora and Hudson River Trading. Dropped out of MIT at 19 to co-found Scale AI. Became world's youngest self-made billionaire in 2022 at age 25. Now serves as Chief AI Officer at Meta, leading Meta Superintelligence Labs.",Chinese-American,
scale-ai,Scale Ai,Lucy Guo,Co-founder (departed 2018),"Studied CS and human-computer interaction at Carnegie Mellon. Thiel Fellow (2014). Worked at Facebook, Quora, and Snapchat. Left Scale AI in 2018 over strategic disagreements, retaining ~5% stake. Founded Backend Capital (VC) and Passes (creator platform). Became a billionaire on paper after Meta's 2025 investment.",Chinese-American,
science-corp,Science Corp,Max Hodak,CEO,Co-founder and former president of Neuralink,American,
scout-ai,Scout Ai,Colby Adcock,CEO & Co-Founder,Former tech private equity executive. Board member at Figure AI.,American,
scout-ai,Scout Ai,Collin Otis,CTO & Co-Founder,Serial entrepreneur. Founding engineer and Director of Autonomy at Kodiak Robotics. Former Head of Data Science at Uber ATG.,American,
scribe,Scribe,Jennifer Smith,Co-Founder & CEO,Former McKinsey consultant. Former Greylock Partners. Built Scribe from the pain of documenting enterprise workflows manually.,American,
scribe,Scribe,Aaron Podolny,Co-Founder & CTO,Former Google engineer (via acquisition of his software automation company). Working with ML technology since 2016.,American,
scrunch-ai,Scrunch Ai,Chris Andrew,Co-Founder & CEO,Former CPO at Hearsay Systems (among first employees).,American,
scrunch-ai,Scrunch Ai,Robert MacCloy,Co-Founder & CTO,Former CTO at Hearsay Systems (among first employees).,American,
seeing-systems,Seeing Systems,Unknown,Co-Founder & CEO,Defense technology and AI background.,,
semgrep,Semgrep,Isaac Evans,CEO & Co-Founder,MIT alumnus. Led development of the open-source Semgrep tool.,American,
semgrep,Semgrep,Drew Dennison,CTO & Co-Founder,MIT alumnus. Technical lead for the Semgrep engine and platform.,American,
semgrep,Semgrep,Luke O'Malley,CPO & Co-Founder,MIT alumnus. Leads product strategy and design.,American,
sennos,Sennos,Jared Resnick,CEO & Co-Founder,Founded Precision Fermentation (rebranded to Sennos in 2025).,American,
sennos,Sennos,Daniel Kulenic,Co-Founder,Co-founded Precision Fermentation with Resnick.,American,
sensetime,Sensetime,Tang Xiao'ou,Co-Founder (deceased Dec 2023),Professor at Chinese University of Hong Kong. Pioneer in computer vision and deep learning research.,Chinese,
sensetime,Sensetime,Xu Li,CEO & Co-Founder,Researcher in computer vision and AI. Led SenseTime from startup to Hong Kong IPO.,Chinese,
sentrial,Sentrial,Unknown,Co-Founder & CEO,MLOps and observability background.,,
serval,Serval,Jake Stauch,CEO & Co-Founder,Previously at Verkada.,American,
serval,Serval,Alex McLeod,Co-Founder,Previously at Verkada.,American,
servo7,Servo7,Unknown,Co-Founder & CEO,Robotics and logistics background.,,
sesame-ai,Sesame Ai,Brendan Iribe,Co-Founder,Co-founder and former CEO of Oculus VR (acquired by Facebook/Meta).,American,
sesame-ai,Sesame Ai,Ankit Kumar,Co-Founder,Former CTO of Ubiquity6 (AR startup).,Indian-American,
sett-ai,Sett Ai,Amit Carmi,CEO & Co-Founder,IDF Unit 8200 alumnus.,Israeli,
sett-ai,Sett Ai,Yoni Blumenfeld,CTO & Co-Founder,IDF Unit 8200 alumnus.,Israeli,
sf-compute,Sf Compute,Evan Conrad,CEO & Co-Founder,Previously building an AI audio model when he identified inflexible GPU compute deals as a pain point.,American,
