company_slug,company_name,founder_name,role,background,origin,status
01-ai,01 Ai,Kai-Fu Lee,CEO,"BS CS Columbia (summa cum laude), PhD CS Carnegie Mellon (pioneered Sphinx speech recognition). Faculty at CMU, then Apple (PlainTalk), SGI (VP), Microsoft Research China (founding director), Google China (president). Founded Sinovation Ventures (2009). TIME 100 Most Influential in AI (2023). Author of 'AI Superpowers'.",Taiwanese-American,
01-ai,01 Ai,Anita Huang,Co-Founder,MS Marketing/Communications Northwestern. Former Director Greater China Marketing at Google (2006-2007). Former Country Marketing Manager Yahoo (2000-2006). VP Marketing & Business Development Tudou.com. Also worked at Sinovation Ventures.,Chinese,
01-ai,01 Ai,Ken Qi,Co-Founder,Previously co-founded Aibee (computer vision AI company). Technical leadership background.,Chinese,
10x-science,10X Science,Unknown,Co-Founder & CEO,Computational biology and AI background.,,
11x,11X,Hasan Sukkar,Founder & Chairman (stepped down as CEO May 2025),Started first online marketplace at 14 in Syria. Immigrated to UK at 17. Masters in Engineering from University of Exeter. Former McKinsey consultant.,Syrian (inferred from name and public bio),
1mind,1Mind,Amanda Kahlow,Founder & CEO,3x entrepreneur. Founder & former CEO of 6sense (unicorn valued over $1B). Started first company at 21.,American (inferred from name and public bio),
1x-technologies,1X Technologies,Bernt Oivind Bornich,Founder & CEO,"Norwegian roboticist. Studied at University of Oslo. Described as a ""science nerd, roboticist, and jack-of-all-trades."" Has led the company from its 2014 founding through rebranding and pivot to consumer humanoids.",Norwegian,
1x-technologies,1X Technologies,Phuong Nguyen,"Co-founder, former CTO",,Vietnamese,
1x-technologies,1X Technologies,Jorgen Sundell,Co-founder (Machinist),,Norwegian,
1x-technologies,1X Technologies,Pal Loken,Co-founder (Board Member),,Norwegian,
21st,21St,Serafim Korablev,Co-Founder & CEO,Full-stack developer. Built multiple developer tools and open-source projects.,Russian,
21st,21St,Dmitry Slepov,Co-Founder & CTO,Software engineer with experience in frontend infrastructure and design systems.,Russian,
4paradigm,4Paradigm,Dai Wenyuan,CEO,Former Chief Architect of Baidu Phoenix Nest. MIT Innovators Under 35.,Chinese,
5mins-ai,5Mins Ai,Saurav Chopra,Co-Founder & CEO,Previously co-founder and CEO of Perkbox. Barclays Scale-Up Entrepreneur of the Year. London Business School Accomplished Entrepreneur Award.,Indian (inferred from name and public bio),
7ai,7Ai,Lior Div,CEO,"IDF Unit 8200 veteran. Co-founded Cybereason (raised $700M+, valued at $3.5B+). Serial cybersecurity entrepreneur.",Israeli,
7ai,7Ai,Yonatan Striem-Amit,CTO,IDF Unit 8200 veteran. Co-founded Cybereason as CTO. Deep expertise in cybersecurity platforms and endpoint detection.,Israeli,
a0-dev,A0 Dev,Ayomide Omolewa,Co-Founder,"Former roles at Nvidia, Paramount, Google, and Lockheed Martin. 7+ years as indie app developer (up to $14K MRR side income).",Nigerian-American,
a0-dev,A0 Dev,Seth Setse,Co-Founder,CMU Class of 2023. Former roles at Microsoft and Teleparty. 7+ years as indie app developer alongside Omolewa.,American,
a0-dev,A0 Dev,Bradley Lafond,Co-Founder,Growth strategist. Joined Omolewa and Setse to handle go-to-market.,American,
aaru,Aaru,Cameron Fink,Co-founder & CEO,Dartmouth College dropout (~age 18-19 at founding). Experience at Kleiner Perkins and Research Science Institute (RSI). ~20 years old.,American,
aaru,Aaru,Ned Koh,Co-founder & President,Harvard dropout (~age 18-19 at founding). Prior research at Northwestern University. Co-founded earlier startups. ~20 years old.,American,
aaru,Aaru,John Kessler,Co-founder & CTO,~15 years old at time of founding (2024). Teen tech prodigy. Leads technical architecture of Aaru's synthetic audience simulation models.,American,
abnormal-security,Abnormal Security,Evan Reiser,CEO & Co-Founder,"BS in Computer Systems Engineering from Rensselaer Polytechnic Institute. Started career at Eastman Kodak (2003) doing ML R&D for intelligence applications, then S&P Capital IQ as a software engineer (2006). Serial founder: founded Bloomspot (online-to-offline advertising, sold to JP Morgan ~2010), then AdStack (ML-powered ad tech, acquired by TellApart 2013). TellApart was acquired by Twitter in 2015. At Twitter (2015-2018), led product management and ML teams for the advertising business.",American,
abnormal-security,Abnormal Security,Sanjay Jeyakumar,CTO & Co-Founder,"BS in EECS from UC Berkeley. MS in Computer Science from Stanford University. Worked at Oracle (2003-2005), PARC intern (2002), then Google (2005-2009) on next-gen Search and Android launch. Founding engineer and architect at TellApart (2009-2015), building personalization systems for large retailers. At Twitter (2015-2018), served as systems architect for distributed data processing and ML systems powering the ads business.",Indian-American,
above-security,Above Security,undisclosed,CEO,Israeli cybersecurity veteran.,Israeli,
abridge,Abridge,"Shiv Rao (Shivdev Rao, MD)",CEO & Co-Founder,BA History Carnegie Mellon (2001). Practicing cardiologist at UPMC. Led UPMC provider-facing investment portfolio (2013-2019). TIME 100 Most Influential in AI (2024). Founded Abridge to solve physician 'pajama time' documentation burden.,Indian-American,
abridge,Abridge,Sandeep Konam,Co-Founder & CTO,MS Robotics Carnegie Mellon (2017). Oversees technical vision and product development at Abridge.,Indian-American,
abridge,Abridge,Florian Metze,Co-Founder (departed 2019),Former Associate Research Professor at CMU Language Technologies Institute. Now Research Scientist Manager at Meta.,German,
act-security,Act Security,Jonathan Langer,CEO,Co-founded Medigate (acq by Claroty).,Israeli,
act-security,Act Security,Itay Kirshenbaum,CTO,Co-founded Medigate.,Israeli,
actively-ai,Actively Ai,Mihir Garimella,Co-Founder & CEO,"Stanford AI researcher, focused on active learning and reasoning.",Indian-American (inferred from name),
actively-ai,Actively Ai,Anshul Gupta,Co-Founder,Stanford AI researcher.,Indian,
ada-support,Ada Support,Mike Murchison,CEO,Serial entrepreneur; built Ada from Toronto into a global enterprise AI platform,Canadian,
ada-support,Ada Support,David Hariri,Co-founder,Co-founded Ada; product and technology leader,Canadian,
adaption,Adaption,Sara Hooker,Co-Founder & CEO,"Former VP of Research at Cohere. Previously part of Google DeepMind. Leading AI researcher known for work on model efficiency, interpretability, and the ""lottery ticket hypothesis."" Recognized as one of the most influential researchers in efficient AI.",American,
adaption,Adaption,Sudip Roy,Co-Founder,"Former head of inference computing at Cohere. Led the infrastructure that makes large language models efficient to deploy in production. Deep expertise in model serving, latency optimization, and compute economics.",Indian-American (inferred),
adaptive-computer,Adaptive Computer,Dennis Xu,Co-Founder & CEO,"Repeat tech startup founder. Previously co-founded Mem, the AI note-taking app that was one of OpenAI's earliest venture investments. Self-described non-programmer, which informs the company's mission to make software creation accessible to everyone.",Chinese-American,
adaptive-computer,Adaptive Computer,Mike Soylu,Co-Founder & President,Co-founded Adaptive Computer alongside Dennis Xu. Handles business operations and partnerships.,American (Turkish descent -- inferred from name),
adaptive-ml,Adaptive Ml,Julien Launay,Co-Founder & CEO,"Previously at Hugging Face, contributed to Falcon and BLOOM open-source LLM projects.",French (inferred from name and Paris base),
adaptive-ml,Adaptive Ml,Baptiste Pannier,Co-Founder,"Previously at Hugging Face, worked on Falcon and BLOOM models.",French (inferred from name),
adaptive-ml,Adaptive Ml,Daniel Hesslow,Co-Founder,"Previously at Hugging Face, research and engineering on Falcon and BLOOM.",Swedish (inferred from name),
adaptive-security,Adaptive Security,Brian Long,Co-Founder & CEO,Serial entrepreneur. Previously co-founded and grew Attentive to $500M in annual revenue. Recognized the threat of AI-enabled impersonation early and pivoted to build AI defenses.,American,
adaptive-security,Adaptive Security,Andrew Jones,Co-Founder,"Serial entrepreneur. Previously co-founded Attentive with Brian Long, scaling it to $500M ARR. Brings deep enterprise sales and product experience.",American,
adept-ai,Adept Ai,David Luan,Co-Founder & former CEO (now at Amazon),Led Google's large model program. Former head of engineering at OpenAI.,Chinese-American,
adept-ai,Adept Ai,Ashish Vaswani,Co-Founder & former Chief Scientist (left for Essential AI),Co-author of the Transformer paper ('Attention Is All You Need'). Former Google Brain researcher.,Indian,
adept-ai,Adept Ai,Niki Parmar,Co-Founder & former CTO (left for Essential AI),Co-author of the Transformer paper. Former Google Brain researcher.,Indian,
adopt-ai,Adopt Ai,Deepak Anchala,Co-Founder & CEO,Previously founded Slintel (acquired by 6sense in 2021). Scaled to 300+ customers and $26M raised.,Indian (inferred),
adopt-ai,Adopt Ai,Rahul Bhattacharya,Co-Founder & CTO,Technical co-founder.,Indian (inferred),
adopt-ai,Adopt Ai,Anirudh Badam,Co-Founder & Chief AI Officer,AI research and engineering.,Indian (inferred),
adsgency-ai,Adsgency Ai,Bolbi Liu,CEO,"Former data scientist/AI engineer at Intel, Bank of America, Sina Weibo. Built AI adtech at DiDi Global and AWS.",,
aegisai,Aegisai,Cy Khormaee,CEO,"MBA Harvard Business School. Former Head of Product / Director of Product Management at Google (Safe Browsing, reCAPTCHA, Web Risk). Previously founded Contastic (acquired by SugarCRM 2016). Former VP Product Management at Attentive.",Iranian-American,
aegisai,Aegisai,Ryan Luo,Co-founder & CTO,"Pomona College, Yale CS Award recipient. 9 years at Google on Safe Browsing and reCAPTCHA teams. Built reCAPTCHA's product-led growth strategy driving adoption by millions of sites.",Chinese-American,
aeon-health,Aeon Health,Tim Seithe,CEO,Previously founded Tillhub (sold to Unzer/KKR),German,
aeon-health,Aeon Health,Samuel Frey,CPO,"Decade in product, led turnaround at Platomics",Swiss/German,
afterquery,Afterquery,Carlos Georgescu,Co-Founder,"Built multiple software businesses, exited an ed-tech startup; former SWE at Citadel Securities; interned at Meta",Romania,
afterquery,Afterquery,Spencer Mateega,Co-Founder,"Award-winning researcher; interned at Meta (SWE), Google (SWE), Morgan Stanley (IB), Silver Lake (PE)",American,
afterquery,Afterquery,Danny Tang,Co-Founder,"Won international Microsoft AI competition; worked at Morgan Stanley (IB), BDT & MSD Partners; Wharton student",American,
agentin-ai,Agentin Ai,Sankeerth Rao Karingula,Founder,Ex-Google Research Scientist,Indian,
agentio,Agentio,Arthur Leopold,Co-Founder & CEO,"Former President at Cameo, the celebrity talent marketplace. First employee at Cameo where he scaled the marketplace from nascency to $500M in sales and grew the creator roster from 10 to 52,000+. Deep expertise in creator economy marketplaces and talent management.",American,
agentio,Agentio,Jonathan Meyers,Co-Founder & CTO,"Former Spotify engineer and manager in the Growth and Innovation organization. Led Spotify's Automated Content Marketing team, driving multi-million dollar MAU outcomes. Brings expertise in programmatic content matching and growth engineering.",American,
agentmail,Agentmail,Haakam Aujla,Co-Founder,YC S25 batch.,South Asian (inferred from name),
agentmail,Agentmail,Michael Kim,Co-Founder & CTO,YC S25 batch.,Korean-American (inferred from name),
agentmail,Agentmail,Adi Singh,Co-Founder,YC S25 batch.,Indian,
agibot,Agibot,Deng Taihua,"Co-Founder, CEO & Chairman",Founded AgiBot in 2023 in Shanghai.,Chinese,
agibot,Agibot,Peng Zhihui,Co-Founder & CTO,Prominent Chinese robotics/AI engineer. Well-known tech influencer in China.,Chinese,
agility-robotics,Agility Robotics,Jonathan Hurst,Co-Founder & Chief Robot Officer,"B.S. in Mechanical Engineering, M.S. and Ph.D. in Robotics, all from Carnegie Mellon University. Professor at Oregon State University, where he co-founded the OSU Robotics Institute and ran the Dynamic Robotics Laboratory. His academic research on physics-based legged locomotion formed the scientific foundation for Cassie and Digit. Transitioned from CTO to Chief Robot Officer in April 2023 to focus on R&D roadmap, industrial design, and innovation pipeline. Remains on OSU faculty.",American,
agility-robotics,Agility Robotics,Damion Shelton,"Co-Founder & Chairman of the Board (formerly CEO, then President, then Chief Engagement Officer)","Ph.D. in Robotics from Carnegie Mellon University, where he met Hurst. Served as CEO from founding through March 2024, then transitioned to President, and later to Chief Engagement Officer (December 2024), focusing on commercial and investor engagement. Now serves as Chairman.",American,
agility-robotics,Agility Robotics,Mikhail Jones,Co-Founder & VP of Software,Was Jonathan Hurst's graduate student at Oregon State University. Leads software development for Digit.,[not publicly detailed],
ai-work,Ai Work,Maor Ezer,Co-Founder & CEO,"Previously sold company to WalkMe (NASDAQ WKME), served as CMO and strategic advisor to CEO at WalkMe.",Israeli,
ai-work,Ai Work,Nir Nahum,Co-Founder & CTO,"Founding team member and CTO of WalkMe. 20+ years enterprise software experience, nine US patents.",Israeli,
ai2-robotics,Ai2 Robotics,Guo Yandong,CEO,"Purdue PhD, former chief scientist at XPeng",Chinese,
ai21-labs,Ai21 Labs,Yoav Shoham,"Co-Founder, Co-CEO","Professor Emeritus of Computer Science, Stanford University; former Google Principal Scientist; PhD CS Yale",Israeli,
ai21-labs,Ai21 Labs,Ori Goshen,"Co-Founder, Co-CEO","Serial entrepreneur (Fring, Crowdx); IDF Unit 8200 veteran; 15+ years technology leadership",Israeli,
ai21-labs,Ai21 Labs,Amnon Shashua,Co-Founder,"CS Professor, Hebrew University of Jerusalem; Co-founder of Mobileye (Intel acquisition, $15.3B), OrCam, OneZero; 160+ papers, 94+ patents",Israeli,
aiceberg,Aiceberg,Alexander Schlager,Founder & CEO,20+ years of technology and cybersecurity expertise.,German/Austrian (inferred from name),
aidoc,Aidoc,Elad Walach,CEO,"BSc CS Technion, BSc Math & Physics Hebrew University. IDF Talpiot program veteran. Led AI research in Israeli Air Force. Forbes 30 Under 30, Modern Healthcare 40 Under 40.",Israeli,
aidoc,Aidoc,Michael Braginsky,CTO,"BSc Physics & CS, MSc CS (Medical Image Processing) Hebrew University. IDF Talpiot program veteran. Former Head of R&D for Israeli Special Forces, deploying state-of-the-art vision technologies.",Israeli (Russian-Jewish heritage),
aifi,Aifi,Steve Gu,CEO,PhD CS from Duke. Former Google X and Apple engineer.,,
aifi,Aifi,Ying Zheng,CTO,PhD computer vision from Duke. EMBA Stanford. Former Google and Apple.,,
aim-security,Aim Security,Matan Getz,Co-Founder & CEO,IDF Unit 8200 veteran. Deputy CISO at the Israel Defense Forces.,Israeli,
aim-security,Aim Security,Adir Gruss,Co-Founder & CTO,Commander of elite cybersecurity education program in the IDF.,Israeli,
air-inc,Air Inc,Shane Hegde,CEO,BS Stanford. Former Chief Digital Strategist at REVOLT. CEO & Co-Founder of Swap (venture-backed fintech). Former PE investor at HPS Investment Partners.,American,
air-inc,Air Inc,Tyler Strand,Co-Founder & CTO,"BS CS Stanford. Former Director of Product at Beatport (launched Beatport Live). Former Partner & Director of PM at Postlight (clients: Goldman Sachs, Time Inc, Bloomberg). Stanford college roommate of Shane Hegde.",American,
airops,Airops,Alex Halliday,Co-Founder & CEO,Led AirOps from inception; background in technology and marketing operations.,British,
airops,Airops,Berna Gonzalez,Co-Founder,Co-founded AirOps alongside Halliday and Hammel.,Uruguayan,
airops,Airops,Matt Hammel,Co-Founder,Co-founded AirOps; operational and technical expertise.,American,
aisera,Aisera,Muddu Sudhakar,CEO,Serial enterprise software founder. Former Caspida (acquired by Splunk).,,
aiuc,Aiuc,Rune Kvist,Co-Founder & CEO,First product and go-to-market hire at Anthropic (2022).,Scandinavian (inferred from name),
aiuc,Aiuc,Brandon Wang,Co-Founder & CTO,Thiel Fellow. Previously founded a consumer underwriting business.,Chinese-American,
aiuc,Aiuc,Rajiv Dattani,Co-Founder,Former McKinsey partner (global insurance). Former COO of METR (AI safety research non-profit).,Indian-British (inferred from name),
albatross-ai,Albatross Ai,Kevin Kahn,Co-Founder & CEO,PhD in applied physics from Imperial College London. MBA from U of Chicago Booth. Previously led ML and recommendation platforms at Amazon Music.,American,
albatross-ai,Albatross Ai,Matteo Ruffini,Co-Founder,PhD. Previously at Amazon.,Italian (inferred from name),
albatross-ai,Albatross Ai,Johan Boissard,Co-Founder,Serial entrepreneur.,French/Swiss (inferred from name),
aleph-alpha,Aleph Alpha,Jonas Andrulis,Founder; Chairman of Advisory Board (as of Jan 2026; stepped down as CEO Oct 2025),"Industrial Engineering, Karlsruhe Institute of Technology (KIT), specialization in AI and modeling Apple, Special Projects Group - Senior AI R&D Manager (multiple years in California); Pallas Ludens - Founder & CEO (machine learning / computer vision startup)",German,
aleph-alpha,Aleph Alpha,Samuel Weinbach,Co-Founder; Co-Chief Research Officer,Unknown (details not publicly available) Deloitte - AI Expert,German (unconfirmed),
aleph-fpa,Aleph Fpa,Albert Gozzi,Co-Founder & CEO,Built the MVP during the pandemic (2020). Y Combinator alum.,Italian/Latin American (inferred from name),
aleph-fpa,Aleph Fpa,Santiago Perez De Rosso,Co-Founder & CTO,PhD from MIT. Previously at DocuSign.,Spanish/Latin American (inferred from name),
alex-ai,Alex Ai,Aaron Wang,Co-Founder & CEO,"Former Facebook engineer, ex-quant at hedge fund.",Chinese-American,
alex-ai,Alex Ai,John Rytel,Co-Founder,Brown University dropout. Technical co-founder.,American,
all-hands-ai,All Hands Ai,Robert Brennan,Co-Founder & CEO,Previously at Google (document summarization). Executive roles at multiple ML/infrastructure startups.,American,
all-hands-ai,All Hands Ai,Graham Neubig,Co-Founder & Chief Scientist,Associate Professor at Carnegie Mellon University. Expert in NLP and language agents.,American (inferred from name and CMU affiliation),
all-hands-ai,All Hands Ai,Xingyao Wang,Co-Founder & Chief AI Officer,PhD student at University of Illinois Urbana-Champaign. Research on interactive language agents.,Chinese,
alphaxiv,Alphaxiv,Juan Orbea De Rivera,Co-Founder & CEO,Stanford/Berkeley graduate.,Spanish/Latin American (inferred from name),
alphaxiv,Alphaxiv,Rehaan Ahmad,Co-Founder,Stanford/Berkeley graduate. Co-launched alphaXiv in May 2023.,South Asian (inferred from name),
alphaxiv,Alphaxiv,Raj Palleti,Co-Founder,Stanford/Berkeley graduate.,Indian,
alphaxiv,Alphaxiv,Daniel Kim,Co-Founder,Stanford/Berkeley graduate.,Korean-American (inferred from name),
alphaxiv,Alphaxiv,Lino Le Van,Co-Founder,Stanford/Berkeley graduate.,Vietnamese/French (inferred from name),
altur,Altur,Luis Olave,Co-Founder,YC S25 batch.,Latin American (inferred from name),
altur,Altur,Pedro Fernandez,Co-Founder,YC S25 batch.,Latin American (inferred from name),
ambience-healthcare,Ambience Healthcare,Mike Ng,Co-Founder / President & Chairman,"BCom Finance University of Sydney, MBA MIT Sloan. Former PE Associate at Calera Capital, IB Analyst at Morgan Stanley. Co-founded Remedy Health. Inspired to enter healthcare after back fracture and misdiagnosis in 2012.",Chinese-American,
ambience-healthcare,Ambience Healthcare,Nikhil Buduma,"Co-Founder / CEO (promoted Sep 2025, formerly Chief Scientist)","MIT. Authored 'Fundamentals of Deep Learning' (O'Reilly), first widely-adopted textbook on modern AI. Two-time gold medalist International Biology Olympiad. Managed drug discovery lab at San Jose State at age 16. Co-founded Lean On Me (national nonprofit) and Remedy Medical. Becker's Rising Stars Under 40.",Indian-American,
ambient-ai,Ambient Ai,Shikhar Shrestha,Co-Founder & CEO,Stanford CS graduate (computer vision). Previously at Apple and Google.,Nepali (inferred from name),
ambient-ai,Ambient Ai,Vikesh Khanna,Co-Founder & CTO,Stanford CS graduate. Previously at Dropbox (large-scale data infrastructure).,Indian,
ami-labs,Ami Labs,Yann LeCun,Chairman,"Turing Award winner (2018) for pioneering work on convolutional neural networks. Former VP and Chief AI Scientist at Meta (2013-2025). PhD from Sorbonne. Professor at NYU. Invented LeNet, foundational to modern deep learning.",American,
ami-labs,Ami Labs,Alex LeBrun,CEO,"Former Meta engineer. Founded Nabla, a digital health AI company (now chairman of Nabla). Serial entrepreneur with deep experience in NLP and conversational AI.",French,
amigo-ai,Amigo Ai,Ali Khokhar,Co-Founder & CEO,Queen's University graduate. Healthcare AI entrepreneur.,Pakistani-American (inferred),
amigo-ai,Amigo Ai,John Xing,Co-Founder & CTO,Technical co-founder.,Chinese-American,
anaconda,Anaconda,Peter Wang,Co-Founder & Chief AI/Innovation Officer,"15+ years in software design across 3D graphics, geophysics, financial risk modeling, and medical imaging. Previously co-created Bokeh visualization library. Continues to lead Anaconda's AI and innovation strategy.",Chinese-American,
anaconda,Anaconda,Travis Oliphant,"Co-Founder (former CEO, departed 2017)",American data scientist and software developer. Creator of NumPy and founding contributor to SciPy -- two of the most foundational libraries in the Python scientific computing ecosystem. Served as CEO until 2017 when company rebranded from Continuum Analytics to Anaconda.,American,
anchain-ai,Anchain Ai,Victor Fang,CEO,PhD. Former FireEye/Mandiant AI cybersecurity lead.,,
anchain-ai,Anchain Ai,Ben Wu,COO,"Former engineering executive at Yahoo, Dell EMC, and Pivotal.",Chinese-American,
anduril,Anduril,Palmer Luckey,Founder,Founded Oculus VR at age 19; sold to Facebook for $2.3B in 2014. Self-taught hardware engineer; attended community college and CSU Long Beach (did not graduate). Built VR headset prototypes starting at age 16. Forbes net worth ~$3.5B (Feb 2026).,American,
anduril,Anduril,Brian Schimpf,Co-Founder & CEO,Former Director of Engineering at Palantir Technologies. Founded Cornell University's autonomous vehicle research program (DARPA Grand Challenge / Urban Challenge). BS in Operations Research & Industrial Engineering from Cornell.,American,
anduril,Anduril,Trae Stephens,Co-Founder & Executive Chairman,"Partner at Founders Fund. Georgetown School of Foreign Service (Arabic & Security Studies). Former computational linguist in the US Intelligence Community (Arabic/Persian). Early employee at Palantir, led defense/intel growth.",American,
anduril,Anduril,Matt Grimm,Co-Founder & COO,Co-founded Cornell's autonomous vehicle team with Brian Schimpf. BS in Mechanical & Aerospace Engineering and MEng in Systems Engineering from Cornell.,American,
anduril,Anduril,Joseph Chen,Co-Founder,"One of the first employees at Oculus VR (hardware/product lead). US Army National Guard paratrooper, 1-143rd Infantry Battalion (Airborne). Prior work in AR at Epson. BA in Electrical Engineering from Rice University; MBA from USC.",Asian American,
angle-health,Angle Health,Ty Wang,Co-Founder & CEO,Former Palantir deployment team. Y Combinator W20.,Chinese-American,
angle-health,Angle Health,Anirban Gangopadhyay,Co-Founder & CTO,Former Palantir machine learning team.,Indian,
ankar,Ankar,Tamar Gomez,Co-Founder & CEO,Doctorate in economics from Imperial College London. Former product manager at Helsing (AI defence tech).,European (inferred from name and London base),
ankar,Ankar,Wiem Gharbi,Co-Founder,Graduate of Telecom Paris. 6 years at Palantir (strategy and product development).,Tunisian/North African (inferred from name),
anomalo,Anomalo,Elliot Shmukler,Co-Founder & CEO,,American (Russian-Jewish heritage),
anomalo,Anomalo,Jeremy Stanley,Co-Founder & CTO,PhD (inferred from technical background),American,
anterior,Anterior,Abdel Mahmoud,Co-Founder & CEO,"Born in Libya, came to UK as refugee at age 8. MEng UCL. Youngest infantry officer in UK (Royal Military Academy Sandhurst at 18). Trained as doctor (NHS), then returned to CS. Former product roles at Google and Meta.",Libyan-British,
anterior,Anterior,Zahid Mahmood,Co-Founder & CTO,"BEng EE Queen Mary University, MSc Engineering Management UCL. Founded first company as teenager. 6 years as Software Engineer at Global Aerospace building payment platforms. Serial founder (Buskana, Crowdfund NFT).",British,
anthropic,Anthropic,Dario Amodei,CEO,"PhD in biophysics from Princeton. VP of Research at OpenAI, where he led development of GPT-2 and GPT-3 and co-invented RLHF. Previously at Baidu and Google.",American,
anthropic,Anthropic,Daniela Amodei,President,BA in English Literature from UC Santa Cruz. Early employee at Stripe (2013). VP of Safety & Policy at OpenAI. Background in global health and politics before tech.,American,
anthropic,Anthropic,Tom Brown,Co-Founder,M.Eng. in Computer Science and Brain & Cognitive Sciences from MIT. Led GPT-3 engineering at OpenAI. Previously at Google Brain. Co-founded YC-backed startup Grouper.,American,
anthropic,Anthropic,Jack Clark,"Co-Founder, Head of Policy",Attended University of East Anglia. Former tech journalist at Bloomberg BusinessWeek and The Register. Policy Director at OpenAI.,American. Educated partly in the UK,
anthropic,Anthropic,Jared Kaplan,"Co-Founder, Chief Science Officer",PhD in physics from Harvard (advised by Nima Arkani-Hamed). Associate professor of physics at Johns Hopkins. Co-authored the landmark 'Scaling Laws for Neural Language Models' paper at OpenAI.,American,
