company_slug,company_name,founder_name,role,background,origin,status
earth-ai,Earth Ai,Roman Teslyuk,"Founder, CEO & CTO",Ukrainian-born. Graduate studies at University of Sydney in mining/geology. Spun Earth AI out of doctoral research.,Ukrainian,
earth-ai,Earth Ai,Igor Gerechko,Co-Founder,,Ukrainian,
edra,Edra,Eugen Alpeza,Co-Founder & CEO,7 years at Palantir. Co-head of forward deployed AI engineering. Started Palantir's work with AT&T. Launched Palantir's AI Platform.,Croatian,
edra,Edra,Yannis Karamanlakis,Co-Founder,First Forward Deployed AI Engineer at Palantir. Led team taking LLMs from demos to production.,Greek,
eightfold,Eightfold,Ashutosh Garg,Co-Founder & Co-CEO,"BTech from IIT-Delhi, PhD from UIUC. Former CTO & Co-Founder of BloomReach. Previously at Google (search/ML infrastructure) and IBM Research. 50+ patents, 30+ papers, author of a book on machine learning.",Indian,
eightfold,Eightfold,Varun Kacholia,Co-Founder & CTO,Ranked,Indian,
eikona,Eikona,Nir Weingarten,Co-Founder & CEO,IDC Herzliya. Based in Tel Aviv.,Israeli,
eikona,Eikona,Omer Hacohen,Co-Founder & CTO,"BSc Ben-Gurion University, BSc Open University of Israel. Former Team Lead AI SDK (Compiler) at NeuReality. Former Israeli Air Force.",Israeli,
elevenlabs,Elevenlabs,Mati Staniszewski,CEO,"Ex-Palantir deployment strategist; studied mathematics at Imperial College London; grew up in Warsaw, Poland",Polish,
elevenlabs,Elevenlabs,Piotr Dabkowski,CTO,"Ex-Google machine learning engineer; degrees from Oxford and Cambridge (AI/ML focus); NeurIPS-published researcher (image detection); grew up in Warsaw, Poland",Polish,
elicit,Elicit,Andreas Stuhlmuller,Co-Founder & CEO,"PhD in Cognitive Science from MIT. Postdoc in Computation and Cognition at Stanford. Co-created WebPPL (probabilistic programming language). Founded Ought, an AI research nonprofit in 2017, from which Elicit was spun out as a public benefit corporation.",German (inferred from name),
eliseai,Eliseai,Minna Song,CEO & Co-Founder,CS degree from MIT. Former intern at Microsoft and MIT Lincoln Laboratory. Discovered real estate communication inefficiencies while working as admin assistant at NYC residential real estate firm. Met Stoyanov at Cambridge.,Korean-American,
eliseai,Eliseai,Stoyan (Tony) Stoyanov,CTO & Co-Founder,CS degree from University of Cambridge. Met Minna Song while both were undergraduates at Cambridge. Co-founded EliseAI in 2017 to automate tenant communication.,Bulgarian,
ema,Ema,Surojit Chatterjee,CEO,"Ex-Coinbase CPO, ex-Google VP",Indian,
emanate,Emanate,Kiara Nirghin,CEO,"Stanford AI researcher, Google Science Fair Grand Prize winner, Thiel Fellow, youngest Google Impact Fund board member",South African (Indian descent),
embedder,Embedder,Ethan Gibbs,Co-Founder,YC S25 batch.,,
embedder,Embedder,Bob Wei,Co-Founder,YC S25 batch.,Chinese-American,
emerald-ai,Emerald Ai,Varun Sivaram,CEO,"Rhodes Scholar, physicist. Ex-McKinsey. Former CTO ReNew (India largest renewable). Biden admin adviser to John Kerry.",Indian-American,
emergent,Emergent,Mukund Jha,CEO,Former Co-Founder/CTO at Dunzo; worked at Google Columbia University (Engineering),Indian,
emergent,Emergent,Madhav Jha,CTO,"Von Neumann postdoctoral fellow at Sandia National Labs; founding member of Amazon SageMaker research team PhD in Theoretical Computer Science, Penn State University",Indian,
encharge-ai,Encharge Ai,Naveen Verma,Co-Founder & CEO,Professor of electrical and computer engineering at Princeton University. 2024 Edison Patent Award. Spun EnCharge out of Princeton research lab.,Indian-American,
encharge-ai,Encharge Ai,Felix Xiaochuan Lin,Co-Founder,,Chinese,
encharge-ai,Encharge Ai,Zizhen Zhong,Co-Founder,,Chinese,
encord,Encord,Eric Landau,Co-Founder & Co-CEO,Former lead quantitative researcher on global equity delta-one desk. Nearly a decade in high-frequency trading at DRW.,American,
encord,Encord,Ulrik Stig Hansen,Co-Founder & Co-CEO/President,Previously worked at J.P. Morgan. MSc Computer Science from Imperial College London.,Danish,
encord,Encord,Leeho Lim,Co-Founder,,Korean,
endra,Endra,Niklas Lindgren,CEO,Serial entrepreneur. Founded Sectragon (sold to PE). Saw MEP design inefficiency.,Swedish,
endra,Endra,Gustav Hammarlund,Technical Co-founder,Built Goldman Sachs EMEA equity trading infrastructure.,Swedish,
enfabrica,Enfabrica,Rochan Sankar,CEO,Former Broadcom and Google executive.,,
enflame-technology,Enflame Technology,Zhao Lidong,CEO,Co-founded Enflame Technology in 2018; leads AI chip development for cloud training and inference,Chinese,
enflame-technology,Enflame Technology,Zhang Yalin,Co-Founder,Co-founded Enflame Technology in 2018,Chinese,
engine-ai,Engine Ai,Zhao Tongyang,Founder & CEO,"8+ years in robotics. Started IoT business in 2012, invested in bipedal robots in 2016. Co-founded Shenzhen Pengxing Intelligent Research with XPeng Motors in 2018.",Chinese,
ensemble,Ensemble,Alex Reneau,Co-Founder & CEO,"PhD research at Northwestern University on programmable feature engineering for time series modeling; published multiple papers defining the field; research directly informed Ensemble's ""Dark Matter"" technology",American,
ensemble,Ensemble,Zach Albertson,Co-Founder & COO,Northwestern University; AI/ML consulting experience where he saw firsthand the challenges enterprises face implementing machine learning; practical background in data science and traditional ML,American,
enso,Enso,Mickey Haslavsky,Founder & CEO,"Co-founder of RapidAPI, one of the world's largest API development platforms.",Israeli,
entalpic,Entalpic,Mathieu Galtier,CEO,Former Chief Data & Platform Officer at Owkin (AI drug discovery unicorn); built Owkin's data partnership network with industrial leaders,French,
entalpic,Entalpic,Victor Schmidt,CTO,Researcher at Mila (Quebec AI Institute); authored papers on predictive and generative models for materials,French-Canadian,
entalpic,Entalpic,Alexandre Duval,CSO (Chief Scientific Officer),Researcher at Mila (Quebec AI Institute); co-authored foundational papers on AI for materials discovery,French,
enter-legal-brazil,Enter Legal Brazil,Mateus Costa-Ribeiro,CEO,"Brazil youngest lawyer at 18, Harvard Law, left Stanford MBA",Brazilian,
entire,Entire,Thomas Dohmke,Founder & CEO,Former CEO of GitHub (Microsoft). Stepped down August 2025 to start Entire.,German,
envariant,Envariant,Unknown,Co-Founder & CEO,ML research and interpretability background.,,
enveda,Enveda,Viswa Colluru,Founder & CEO,"PhD in immuno-oncology from University of Wisconsin-Madison. First Innovation Scientist and Product Manager at Recursion Pharmaceuticals. Son of a pharmacist from Visakhapatnam, India. Built Enveda from $55k of personal savings. Named UBS Global Visionary 2023, WEF Unicorn Innovator Community member.",Indian,
enveda,Enveda,Pieter Dorrestein,Scientific Co-Founder,One of the world's foremost experts in applying mass spectrometry to metabolomics. Professor at UC San Diego.,Dutch (inferred),
eon,Eon,Ofir Ehrlich,CEO,AWS alumnus; co-founded CloudEndure (acquired by Amazon in 2019); IDF Unit 8200 graduate,Israeli,
eon,Eon,Ron Kimchi,Co-founder,AWS alumnus; leads R&D center in Tel Aviv,Israeli,
eon,Eon,Gonen Stein,Co-founder,AWS alumnus; oversees business operations from New York,Israeli,
eos-ai,Eos Ai,Unknown,Co-Founder & CEO,Healthcare technology and AI background.,,
epirus,Epirus,Bo Marr,Co-Founder,Defense technology entrepreneur. Also co-founded Chaos Industries. Background in electromagnetic systems and directed-energy technology.,American,
epirus,Epirus,Joe Lonsdale,Co-Founder,Co-founder of Palantir Technologies and managing partner of 8VC. Stanford University graduate. One of the most prolific defense tech investors and company builders in Silicon Valley.,American,
epirus,Epirus,John Tenet,Co-Founder,Defense tech entrepreneur who later co-founded Chaos Industries. Background in defense technology and electronic warfare.,American,
epirus,Epirus,Max Mednik,Co-Founder,Technology entrepreneur and investor. Background in building technology companies.,American,
epirus,Epirus,Nathan Mintz,Co-Founder,Defense technology entrepreneur with expertise in directed-energy systems and counter-electronics applications.,American,
eragon-ai,Eragon Ai,Josh Sirota,Co-Founder & CEO,Previously at Oracle and Salesforce go-to-market teams. Scaled a Salesforce operating unit from inception to $200M ARR.,American,
eragon-ai,Eragon Ai,Rishabh Tiwari,Co-Founder,Berkeley CS PhD.,Indian,
eragon-ai,Eragon Ai,Vinayak Agarwal,Co-Founder,MIT PhD. Co-founder of K-Dense.,Indian,
eridu,Eridu,Drew Perkins,CEO & Co-Founder,"Networking industry veteran since the 1980s. Helped create Point-to-Point Protocol (PPP), a key part of TCP/IP. Co-founded Lightera Networks (sold to Ciena for $500M+, 1999). Co-founded Infinera (IPO'd, later sold to Nokia for $2.3B in 2025).",American,
eridu,Eridu,Omar Hassen,Chief Product Officer & Co-Founder,"Deep networking chip design experience. Previously held senior roles at Broadcom, Marvell, and International Rectifier managing chip design divisions.",Limited public information,
eridu,Eridu,Mike Capuano,Chief Business Development & Marketing Officer & Co-Founder,Most recently SVP of Business Development at Ventana Systems (RISC-V server chips). Background in semiconductor business development.,American,
espresso-ai,Espresso Ai,Ben Lerner,Co-Founder & CEO,Technical founder with expertise in cloud infrastructure and optimization.,American,
espresso-ai,Espresso Ai,Juri Ganitkevitch,Co-Founder,Technical co-founder with ML and NLP expertise.,German,
espresso-ai,Espresso Ai,Alex Kouzemtchenko,Co-Founder,Technical co-founder.,Russian-Australian,
espresso-ai,Espresso Ai,Nima Badizadegan,Co-Founder,Technical co-founder.,Iranian-American,
essential-ai,Essential Ai,Ashish Vaswani,Co-Founder & CEO,"BEng CS Birla Institute of Technology Mesra (2002), PhD CS USC (advised by David Chiang). Former researcher at Google Brain. Co-author of 'Attention Is All You Need' (2017) — the seminal paper introducing the Transformer architecture that underpins GPT, BERT, and modern LLMs.",Indian,
essential-ai,Essential Ai,Niki Parmar,Co-Founder (departed ~September 2024),"MS CS USC. Former researcher at Google (sentence similarity, question answering). Co-author of 'Attention Is All You Need' (2017). Close collaborator with Vaswani at Google.","Indian (from Pune, India)",
etched,Etched,Gavin Uberti,CEO,Harvard dropout; leading effort to build transformer-only ASIC inference chips,American,
etched,Etched,Chris Zhu,CTO,Harvard dropout; co-founded Etched in 2022,Chinese-American,
etched,Etched,Robert Wachen,Co-Founder,Harvard dropout; co-founded Etched in 2022,American,
eudia,Eudia,Omar Haroun,Co-Founder & CEO,Founded and sold Text IQ to Relativity. Led AI strategy at Relativity post-acquisition.,Egyptian-American,
eudia,Eudia,Ashish Agrawal,Co-Founder & CTO,"Technical leadership roles at Amazon, Apple, and Google.",Indian,
eudia,Eudia,David Van Reyk,Co-Founder & COO,Private equity and business transformations at CVC Capital Partners.,Australian,
eve-legal,Eve Legal,Jay Madheswaran,Co-Founder & CEO,15+ years in AI/ML at Facebook and Rubrik. Previously with Lightspeed Venture Partners.,South Asian,
eve-legal,Eve Legal,Matt,Co-Founder & CPO,Founding engineer at Rubrik. Decade of experience building AI products.,American,
eve-legal,Eve Legal,David Zeng,Co-Founder & Head of Engineering,10+ years in AI and machine learning.,Chinese-American,
evenup,Evenup,Rami Karabibar,CEO & Co-Founder,"Background in startup and VC operations. Previously worked across private equity, venture capital, and venture-backed startups including roles at Bain and Waymo.",Middle Eastern,
evenup,Evenup,Saam Mashhad,CPO & Co-Founder,Former litigation attorney. Legal background drives EvenUp's approach to AI-assisted demand letter generation and case workflow optimization.,Iranian-American,
evenup,Evenup,Raymond Mieszaniec,COO & Co-Founder,"BA Economics Simon Fraser University, MBA HKUST. Two-time entrepreneur (co-founded EquitySim). Former risk consultant at PwC Hong Kong. Former accountant at Scotiabank. Personal motivation: father permanently disabled in police-chase car accident, family received only 10% of average payout.",Canadian,
evertune,Evertune,Brian Stempeck,CEO,"Former Trade Desk (grew from 8 people to IPO), Nielsen board",American,
evident,Evident,Elena Samuylova,Co-Founder & CEO,"7+ years helping large enterprises deploy ML systems; Co-Founder and CPO at Mechanica AI (industrial AI startup); led business development at Yandex Data Factory (enterprise AI division of Yandex); Graduate School of Management, St. Petersburg State University and Vienna University of Economics; named in ""50 Women in Product Europe"" (2018)",Russia,
evident,Evident,Emeli Dral,Co-Founder & CTO,BS and MS in Applied Mathematics from Peoples' Friendship University of Russia; MS in Computer Science from Yandex School of Data Analysis; Chief Data Scientist at Yandex Data Factory; co-founded Mechanica AI; co-author of most popular Russian-language ML course on Coursera (100K+ students); 50+ real-world ML projects,Russia,
evisort,Evisort,Jerry Ting,CEO,"First-generation American. Harvard Law School. USC Summa Cum Laude, Trustee Scholar. Forbes 30 Under 30.",,
evolved-robotics,Evolved Robotics,Gur Kimchi,Co-founder,"Co-founder Amazon Prime Air, former VP Amazon",Israeli,
evolved-robotics,Evolved Robotics,Matthew Skeels,CEO,"Former Amazon Prime Air, former BRINC",,
exa,Exa,Will Bryk,CEO,CS & Physics Harvard. Led Harvard robotics club. One of the first engineers at Cresta (built real-time AI products). Published author on history of civilization. YC S21.,American,
exa,Exa,Jeff Wang,Co-Founder,CS & Philosophy Harvard. 3 years building data and web infrastructure at Plaid. Harvard roommate of Will Bryk. Ran GPU cluster in his dorm room.,American,
fable-security,Fable Security,Nicole Jiang,Co-Founder & CEO,Founding team member at Abnormal AI. Helped scale to hundreds of millions ARR. Pioneered behavioral-based security.,Chinese-American,
fable-security,Fable Security,Sanny Liao,Co-Founder & CPO,Dr. Founding team member at Abnormal AI. Pioneered behavioral-based security concept.,Chinese-American,
factory-ai,Factory Ai,Matan Grinberg,CEO,PhD in theoretical physics; met co-founder at an AI hackathon,American,
factory-ai,Factory Ai,Eno Reyes,CTO,Former data scientist at Hugging Face and Microsoft; thesis on deep learning and language models,Filipino-American,
fal-ai,Fal Ai,Burkay Gur,Co-Founder & CEO,Previously at Coinbase.,Turkish,
fal-ai,Fal Ai,Gorkem Yurtseven,Co-Founder,Previously at Amazon.,Turkish,
fauna-robotics,Fauna Robotics,Rob Cochran,Co-Founder & CEO,Former CTRL-labs (acquired by Facebook/Meta in 2019). Wearable neurotech experience.,American,
fauna-robotics,Fauna Robotics,Josh Merel,Co-Founder & CTO,Former DeepMind research scientist. Neuroscience and robotics research.,American,
fenrock,Fenrock,Unknown,Co-Founder & CEO,Financial compliance and AI background.,,
field-ai,Field Ai,Ali Agha,Founder & CEO,"Spent nearly a decade at NASA's Jet Propulsion Laboratory (JPL) specializing in robotics autonomy and physical AI. Led teams that competed in the DARPA Subterranean Challenge. Built FieldAI's core technology around enabling robots to operate autonomously without GPS, maps, or pre-programmed routes.",Iranian-American,
fieldguide,Fieldguide,Jin Chang,Co-Founder & CEO,Former EY practitioner. Previously at legal AI startup Atrium.,Korean-American,
fieldguide,Fieldguide,Chris Szymansky,Co-Founder & CTO,Previously at legal AI startup Atrium where he met Jin Chang.,American,
figure-ai,Figure Ai,Brett Adcock,Founder & CEO,"American, raised on a family farm near Moweaqua, Illinois. BS from University of Florida (2008). Serial entrepreneur: founded Vettery (hiring marketplace, acquired by Adecco Group ~2018), co-founded Archer Aviation (eVTOL, NYSE: ACHR, IPO 2021). Named to TIME100 AI list (2024). Also founded Cover (AI school-security startup, 2023) and Hark (independent AI lab, self-funded $100M, late 2025). Remains CEO of both Figure and Hark.","American (white, rural Illinois)",
filed,Filed,Leroy Kerry,Co-Founder & CEO,Previous startup experience from Swedish fintech Juni.,British,
filed,Filed,Atul Ramachandran,Co-Founder & CTO,Former engineering leader at PayPal.,Indian,
final-round-ai,Final Round Ai,Michael Guan,Co-Founder & CEO,Yale University. Former CTO at CYNK; previously in product marketing at Starburst Data (supported $250M Series D).,Chinese-American,
final-round-ai,Final Round Ai,Jay Ma,Co-Founder & CTO,"University of Illinois at Urbana-Champaign. Former ML engineer at Pinterest, Meta, and AMD. Reverse-engineered LinkedIn while in college.",Chinese-American,
finster-ai,Finster Ai,Sid Jayakumar,Founder,7 years AI research at Google DeepMind,Indian-British,
finto,Finto,Jonas Morgner,Co-Founder,YC S25 batch.,German (inferred from name),
finto,Finto,Linus Boehm,Co-Founder,YC S25 batch.,German (inferred from name),
finto,Finto,Lorenz Neuner,Co-Founder,YC S25 batch.,German (inferred from name),
firecrawl,Firecrawl,Caleb Peffer,Co-Founder & CEO,"Serial builder with 10+ years in software engineering. Previously built Mendable (chat-with-docs, customers included Snapchat, Coinbase, MongoDB) and co-founded SideGuide (learn-to-code in VS Code, 50K users). YC alum (S22).",American,
firecrawl,Firecrawl,Eric Ciarla,Co-Founder & CMO,Studied Economics and Philosophy at University of New Hampshire. Former Data Scientist at Ford and Fracta. Co-founded Mendable and SideGuide with Peffer and Camara before Firecrawl.,American,
firecrawl,Firecrawl,Nicolas Silberstein Camara,Co-Founder & CTO,"Studied at University of New Hampshire. Previously built Mendable (AI docs search), SideGuide, FlutterBricks, and HallHub. Creator of FlutterGuide community (50K developers). Firecrawl was originally an internal tool at Mendable.",American,
fireflies-ai,Fireflies Ai,Krish Ramineni,Co-Founder & CEO,"Former product manager at Microsoft. UPenn grad (summa cum laude, HCI). Forbes 30 Under 30 (2021).",Indian-American,
fireflies-ai,Fireflies Ai,Sam Udotong,Co-Founder & CTO,,Nigerian,
fireworks-ai,Fireworks Ai,Lin Qiao,CEO,"PhD CS, UC Santa Barbara. Former Head of PyTorch at Meta.",Chinese-American,
fireworks-ai,Fireworks Ai,Benny Chen,Co-founder,Former Meta Ads Infrastructure Lead.,Chinese-American,
fireworks-ai,Fireworks Ai,Dmytro Dzhulgakov,Co-founder,PyTorch core maintainer at Meta.,Ukrainian,
fish-audio,Fish Audio,Shijia Liao (Leng Yue),CEO,Former NVIDIA researcher. Gen Z. 7+ years in speech synthesis. Creator of GPT-SoVITS.,,
flair,Flair,Mickey Friedman,Co-Founder & CEO,University of Chicago graduate. Co-launched Flair.ai in 2022. Previously worked with AI teams and organizes SF AI Tinkerers events.,American,
flair,Flair,Antonio Cao,Co-Founder & President,"Yale University graduate with degrees in Physics, Mathematics, and Computer Science. Previously worked with AI teams at companies including Tesla and Adobe.",Chinese-American,
flank-ai,Flank Ai,Lilian Breidenbach,Co-Founder,Previously co-founded Legal OS. Enterprise legal tech experience.,German (inferred),
flank-ai,Flank Ai,Charlotte Kufus,Co-Founder,Left PhD research at LSE to co-found Flank.,German (inferred),
flank-ai,Flank Ai,Jacob Jones,Co-Founder,8+ years in AI. Leads product and commercial strategy.,British (inferred),
flapping-airplanes,Flapping Airplanes,Ben Spector,Co-founder,"Founder of Prod, a Silicon Valley talent incubator that shaped companies like Cursor, Mercor, Etched, and Decart. Age 25 at founding. Brother of Asher Spector.",American,
flapping-airplanes,Flapping Airplanes,Asher Spector,Co-founder,Former debate champion turned Stanford Statistics PhD student. Age 26 at founding. One year older than brother Ben.,American,
flapping-airplanes,Flapping Airplanes,Aidan Smith,Co-founder,Former founder and Thiel Fellow. Worked at Neuralink for 3 years while in college at Georgia Tech.,American,
flex-ai,Flex Ai,Brijesh Tripathi,Co-founder & CEO,"Veteran chip and systems architect. Senior design engineer at NVIDIA (early career). Senior engineering roles at Apple. Senior engineering at Tesla (reported to Elon Musk). Engineering leadership at Zoox. GM & Chief Architect for AI and Supercompute Platforms at Intel, previously VP & CTO of Client Computing Group.",Indian,
flex-ai,Flex Ai,Dali Kilani,Co-founder & CTO,"Technical roles at NVIDIA. Engineering at Zynga. Consulting at Boston Consulting Group. CTO at Lifen (French healthtech startup, digital infrastructure for healthcare). Brings software and platform-building lens complementing Tripathi's hardware expertise.",Tunisian-French,
flexion,Flexion,Nikita Rudin,Co-Founder & CEO,PhD from ETH Zurich (deep reinforcement learning for robotics). Former research scientist at NVIDIA (Isaac Gym).,Russian-Swiss,
flexion,Flexion,David Hoeller,Co-Founder & CTO,"PhD in reinforcement learning. Managed research at NVIDIA (Isaac Gym, Isaac Lab). 10+ years in robot learning.",Swiss,
flexion,Flexion,Julian Nubert,Co-Founder,"PhD from ETH Zurich. Research stays at Meta Reality Labs, NASA JPL, AWS, Max Planck Institute.",German,
flexion,Flexion,Fabian Tischhauser,Co-Founder,Robotics hardware background. Leads hardware team at Flexion.,Swiss,
flexion,Flexion,Marco Hutter,Co-Founder,Professor of Robotic Systems at ETH Zurich. Director of RAI Institute Zurich.,Swiss,
floot,Floot,Yujian Yao,Co-Founder,YC S25 batch.,Chinese,
floot,Floot,Edward Look,Co-Founder,YC S25 batch.,,
flowith,Flowith,Yichen Wu,Co-founder,Chinese-born. UNC Chapel Hill.,Chinese,
flowith,Flowith,Derek Nee,CEO,Chinese-born. Co-founded Flowith.,Chinese,
flywheel,Flywheel,Troy Kopischke,Co-Founder & Board Chair,"Serial tech entrepreneur. Co-CEO, co-founder, and managing partner of Invenshure (venture catalyst for tech/biotech companies built on novel IP from top scientists). Former President and CFO at Steady State Imaging (commercialization strategy led to sale to GE Healthcare 2011).",American,
flywheel,Flywheel,Brian Wandell,Co-Founder & Scientific Advisor,"Director of the Center for Cognitive and Neurobiological Imaging at Stanford University. Developed MRI image capture, organization, and curation system that became Flywheel. Partnered with Invenshure in 2015 to commercialize.",American,
flywheel,Flywheel,Gunnar Schaefer,Co-Founder & CTO,Stanford researcher who partnered with Wandell to develop the medical imaging data management system. Technical architect of Flywheel's platform for organizing and sharing neuroimaging data.,American,
forethought,Forethought,Deon Nicholas,Co-Founder & Executive Chairman,"Bachelor of Mathematics from University of Waterloo. Built products at Facebook, Palantir, Dropbox, and Pure Storage. Forbes 30 Under 30. Holds patents in ML. Angel investor in Cognition (Devin) and Anthropic.",Canadian (grew up in inner-city Toronto),
forethought,Forethought,Sami Ghoche,Co-Founder & CEO,Harvard University (undergrad and graduate studies in Computer Science). Previously on LinkedIn's AI/ML team enhancing newsfeed relevance. Forbes 30 Under 30. Co-founded Forethought at age 24 with Nicholas.,Lebanese-American,
formation-bio,Formation Bio,Benjamine Liu,CEO,Rhodes Scholar; PhD at Oxford in computational biology; Yale graduate (highest honors); MPhil from Cambridge; former Agouron Pharmaceuticals,Chinese-American,
formation-bio,Formation Bio,Linhao Zhang,CTO,Technical co-founder leading AI-driven drug development platform,Chinese,
forsight-robotics,Forsight Robotics,Prof. Moshe Shoham,Co-founder,"Professor at the Technion - Israel Institute of Technology. Pioneer in medical robotics, previously co-founded Mazor Robotics (acquired by Medtronic for $1.64B in 2018). One of the most accomplished surgical robotics entrepreneurs globally.",Israeli,
forsight-robotics,Forsight Robotics,Dr. Daniel Glozman,Co-founder & CEO,Medical robotics expert with deep experience in surgical systems development. Leads ForSight's commercialization and clinical trial strategy.,Israeli,
forsight-robotics,Forsight Robotics,Dr. Joseph Nathan,Co-founder,,Israeli,
forterra,Forterra,Alberto Lacaze,Co-Founder,Long career in autonomous systems and robotics for defense.,American,
forterra,Forterra,Karl Murphy,Co-Founder,Defense robotics and autonomy expert.,American,
fourier-intelligence,Fourier Intelligence,Alex Gu (Gu Jie),Founder & CEO,Graduated from Shanghai Jiao Tong University. Previously a sales executive at National Instruments. Founded Fourier in 2015 with a focus on rehabilitation robotics before pivoting to general-purpose humanoid robots. Has led the company through nine funding rounds.,Chinese,
fractal,Fractal,Srikanth Velamakanni,"Co-Founder, Group Chief Executive & Executive Vice-Chairman","Engineering and finance background. Former structured products group at ICICI Bank, where he co-pioneered India's first collateralized bond obligation (CBO) in 1999.",Indian,
fractal,Fractal,Pranay Agrawal,Co-Founder & CEO,"Education from Indian Institute of Management, Ahmedabad (IIM-A). Appointed CEO in 2016.",Indian,
freenome,Freenome,Gabriel Otte,Co-Founder (former CEO),Co-founded Freenome in 2014; replaced as CEO by Mike Nolan in 2021,American,
freenome,Freenome,Charlie Roberts,Co-Founder,Co-founded Freenome in 2014,American,
freenome,Freenome,Riley Ennis,Co-Founder,Co-founded Freenome in 2014,American,
freya-voice-ai,Freya Voice Ai,Tomas Nepala,Co-Founder,YC S25 batch.,European (inferred from name),
freya-voice-ai,Freya Voice Ai,Ahmet Tunga Bayrak,Co-Founder,YC S25 batch.,Turkish (inferred from name),
fundamental-ai,Fundamental Ai,Jeremy Fraenkel,CEO & Co-Founder,Former DeepMind researcher. Details on specific DeepMind projects limited in public sources.,American (limited public information),
