company_slug,company_name,founder_name,role,background,origin,status
leaping-ai,Leaping Ai,Kevin Wu,CEO & Co-Founder,"BS in CS from Technical University of Munich, with studies at Carnegie Mellon, NUS, Peking University. Former Associate at Boston Consulting Group (2020-2023). Interned at Global Founders Capital and Amazon. YC W25.",German-Chinese,
leaping-ai,Leaping Ai,Arkadiy Telegin,CTO & Co-Founder,"Born and raised in Kazakhstan. MSc in CS at Technical University of Munich, Visiting Scholar at University of Tokyo. Former Associate at BCG (3 years). Chief Software Officer at WARR Space Robotics (CRATER Mars rover). Previously at Microsoft and Plus.",Kazakhstani,
legion-ai,Legion Ai,Ely Abramovitch,Co-Founder & CEO,Prior experience at Microsoft Sentinel.,Israeli,
legion-ai,Legion Ai,Michael Gladishev,Co-Founder & VP R&D,Prior experience at Microsoft Sentinel.,Israeli,
legion-ai,Legion Ai,Eyal Fisher,Co-Founder & CTO,Cambridge AI research background.,Israeli,
legora,Legora,Max Junestrand,CEO,Swedish. 25 years old at founding. Dual degrees in ML and Business from KTH and SSE. Previously at McKinsey. YC alumni.,Swedish,
legora,Legora,Sigge Labor,Co-founder,Swedish co-founder.,Swedish,
leiniao-innovation,Leiniao Innovation,Li Hongwei,CEO & Founder,Technology executive with expertise in AR/VR and consumer electronics. Built Leiniao into the global leader in AR glasses sales.,Chinese,
leo-ai,Leo Ai,Maor Farid,Co-Founder & CEO,Dr. PhD in mechanical engineering at Technion (Israel) at age 24. Postdoc at MIT in applied mathematics and AI.,Israeli,
leo-ai,Leo Ai,Moti Moravia,Co-Founder & CTO,Mechanical engineer and AI expert. Met Maor Farid at age 18 in Israeli military's Brakim program.,Israeli,
lepton-ai,Lepton Ai,Yangqing Jia (Jia Yangqing),Co-Founder & CEO,"PhD in EECS from UC Berkeley, BS from Tsinghua University. Creator of Caffe deep learning framework. Founding engineer and Director of Facebook AI infrastructure. VP of Big Data and AI at Alibaba. Contributed to ONNX and PyTorch. Lepton acquired by NVIDIA.",Chinese,
lepton-ai,Lepton Ai,Bai Junjie,Co-Founder,MS in Computational Science and Engineering and BS in Mathematics from Technical University of Munich. Former Director of AI Platform at Alibaba. Technical Lead at Facebook AI. Quantitative Strategist at KCG Holdings. Helped develop PyTorch.,Chinese,
leta-logistics,Leta Logistics,Nick Joshi,CEO & Founder,10+ years of tech leadership in the US and Africa. Studied at University of Western Australia. Founded Leta in 2021 to apply AI to efficient goods movement for businesses across Africa.,Kenyan-American,
leta-logistics,Leta Logistics,Kip Maritim,CTO,"Led development and delivery of Leta's tech, overseeing product and engineering. Had a full-fledged tech team from previous collaborations before joining Leta. Builds solutions for supply chain control.",Kenyan,
leta-logistics,Leta Logistics,Anthony Ketter,COO / Chief Growth Officer,"Leads growth at Leta focusing on market expansion and customer success across Africa. Extensive business development and operations experience across FMCG, telcos, and tech.",Kenyan,
letta,Letta,Sarah Wooders,CEO,"Berkeley PhD, Sky Computing Lab",American,
letta,Letta,Charles Packer,CTO,"Berkeley PhD, Sky Computing Lab",American,
liblib-ai,Liblib Ai,Chen Mian,Founder & CEO,"Born 1992. Former ByteDance employee, headed commercialization for Jianying and CapCut teams. Left ByteDance May 2023 to found LiblibAI.",Chinese,
lightelligence,Lightelligence,Shen Yichen,CEO,PhD MIT Physics. Born 1989. Pioneered optical computing at MIT.,,
lightelligence,Lightelligence,Marin Soljacic,Co-founder,MIT professor of physics.,,
lightelligence,Lightelligence,Paul Xie,Co-founder,MIT researcher.,,
lightmatter,Lightmatter,Nicholas Harris,CEO,PhD from MIT Quantum Photonics Lab. 87+ patents. Optica Fellow. Prior R&D at Micron Technologies.,American,
lightmatter,Lightmatter,Darius Bunandar,Chief Scientist,PhD from MIT Quantum Photonics Lab.,Indonesian-American,
lightricks,Lightricks,Zeev Farbman,CEO,PhD student at Hebrew University of Jerusalem; computer vision researcher,Israeli,
lightricks,Lightricks,Nir Pochter,Co-founder,PhD student at Hebrew University of Jerusalem,Israeli,
lightricks,Lightricks,Yaron Inger,Co-founder,PhD student at Hebrew University of Jerusalem,Israeli,
lightricks,Lightricks,Amit Goldstein,Co-founder,PhD student at Hebrew University of Jerusalem,Israeli,
lightricks,Lightricks,Itai Tsiddon,Co-founder,Former Supreme Court of Israel clerk,Israeli,
lila-sciences,Lila Sciences,Geoffrey von Maltzahn,CEO,GP at Flagship Pioneering. Co-founded 10 companies with $10B combined market cap.,American,
lila-sciences,Lila Sciences,Noubar Afeyan,Chairman,Founder/CEO Flagship Pioneering. Co-founded Moderna.,Armenian-Lebanese-American,
limbic,Limbic,Ross Harper,Co-Founder & CEO,Dr.,British,
limbic,Limbic,Sebastiaan de Vries,Co-Founder,,Dutch,
liminal-experiences,Liminal Experiences,Brendan Mulligan,Founder & CEO,"8 years at Riot Games leading investments, acquisitions, strategic partnerships, and League of Legends economy design.",American,
liminal-experiences,Liminal Experiences,David Lieberman,Co-Founder & Technical Co-Founder,Former Group Product Lead at Riot Games. VP of Engineering at no-code game engine Buildbox.,American,
limx-dynamics,Limx Dynamics,Wei Zhang,Co-Founder & CEO,Dr. Tenured professor. PhD from Purdue University.,Chinese,
limx-dynamics,Limx Dynamics,Li Zhang,Co-Founder & COO,Former COO at WeRide (autonomous driving).,Chinese,
limy,Limy,Aviv Shamny,Co-Founder & CEO,a16z speedrun scout.,Israeli,
limy,Limy,Ido Zabarsky,Co-Founder & COO,a16z speedrun scout.,Israeli,
limy,Limy,Ori Riechman,Co-Founder & CTO,,Israeli,
lio,Lio,Vladimir Keil,Co-Founder & CEO,Had a profitable startup by age 22. Co-founded Gabriel AI (partnered with German FBI for telephone fraud prevention). Experienced procurement problems firsthand while selling enterprise software. YC S23.,German,
lio,Lio,Lukas Heinzmann,Co-Founder & CTO,MS in AI/ML from Technical University of Munich. One of first employees at startup acquired by Audi (brought AI/ML to mobile apps). Technical lead for myAudi app (tripled user base). Co-founded Gabriel AI.,German,
lio,Lio,Till Wagner,Co-Founder & COO,Experience in web/app design and product-building at AI startups in SF. Operational and analytic experience at Deloitte's biggest German client. Worked at SAP. His failure buying equipment with SAP's own software inspired Lio's creation.,German,
liquid-ai,Liquid Ai,Ramin Hasani,CEO,PhD in CS from TU Wien (Austria) with distinction; MIT CSAIL scientist; research on liquid neural networks and robust deep learning,Iranian,
liquid-ai,Liquid Ai,Mathias Lechner,Co-Founder,MIT CSAIL researcher; co-inventor of liquid neural networks,Austrian,
liquid-ai,Liquid Ai,Alexander Amini,Co-Founder,MIT CSAIL researcher; co-inventor of liquid neural networks,Iranian-American,
liquid-ai,Liquid Ai,Daniela Rus,Co-Founder,Director of MIT CSAIL; one of the world's most prominent robotics and AI researchers,Romanian-American,
livekit,Livekit,Russ d'Sa,Co-Founder & CEO,"BS and MS in Computer Science from UC Davis. Previously at Twitter and 23andMe. Co-founded Evie Labs (acquired by Medium, 2019). Led product at Medium for creators and readers. Started LiveKit during Covid-19 pandemic.",American,
livekit,Livekit,David Zhao,Co-Founder & CTO,Studied Computer Engineering at University of Washington. Director of Engineering at Medium. Co-founded Evie Labs and Zecter (acquired by Motorola Mobility). Previously at Amazon. Senior Venture Partner at Pioneer Fund.,American,
lizzyai,Lizzyai,Yannis Niebelschuetz,Founder & CEO,"Previously Founder & CEO of CoachHub (raised $350M+, expanded to 7 offices globally, clients include Ford, Coca-Cola, Virgin Atlantic). Former Senior Manager at LinkedIn.",German,
llamaindex,Llamaindex,Jerry Liu,Co-Founder & CEO,"BSE in CS with certificate in finance from Princeton (2017, Shapiro Prize, Outstanding Senior Thesis Award). ML Engineering Manager at Robust Intelligence. Research Scientist at Uber (2018-2021). ML Engineer at Quora. Interned at Two Sigma and Apple.",Chinese-American,
lmarena,Lmarena,Anastasios N. Angelopoulos,CEO,PhD EECS UC Berkeley,Greek-American,
lmarena,Lmarena,Wei-Lin Chiang,CTO,PhD EECS UC Berkeley,Taiwanese-American,
lmarena,Lmarena,Ion Stoica,Co-founder/Advisor,"Berkeley professor, co-founded Databricks and Anyscale",Romanian-American,
lorikeet,Lorikeet,Jamie Hall,Co-Founder & CEO,Former research tech lead at Google Brain. Third named author on Google's 2022 LaMDA paper. Fourth author on 2020 Meena paper.,Australian,
lorikeet,Lorikeet,Steve Hind,Co-Founder,Led product teams at Stripe and Watershed.,Australian,
loti-ai,Loti Ai,Luke Arrigoni,Co-Founder & CEO,Ran an AI consulting firm for a decade. Former data scientist at CAA (talent agency).,American,
loti-ai,Loti Ai,Rebekah Arrigoni,Co-Founder,,American,
loti-ai,Loti Ai,Hirak Chhatbar,Co-Founder,Serial entrepreneur.,Indian,
louiza-labs,Louiza Labs,Larissa Tyagi,Co-Founder,YC S25 batch.,Indian-American,
louiza-labs,Louiza Labs,Georgia Witchel,Co-Founder,YC S25 batch.,,
lovable,Lovable,Anton Osika,Co-Founder & CEO,"Studied Industrial Economics at KTH Royal Institute of Technology (completed at double speed). Worked in particle physics at CERN. First technical hire at Ampfield, founding engineer at Sana (Enterprise AI). Co-founded Depict.ai (CTO). Created GPT Engineer (one of fastest-growing GitHub repos). Europe's youngest self-made billionaire at 26.",Swedish,
lovable,Lovable,Fabian Hedin,Co-Founder & CTO,BS in Industrial Engineering and Management from KTH (2021). Built proptech firm TenFAST. Developed the computer interface used by physicist Stephen Hawking. Collaborated with former SpaceX engineers on wheelchair technology. Front-end engineering lead at Depict (2022-2023).,Swedish,
luma-ai,Luma Ai,Amit Jain,Co-Founder & CEO,"Former Systems and ML Engineer at Apple, led Passthrough feature for Apple Vision Pro",Indian,
luma-ai,Luma Ai,Alberto Taiuti,Co-Founder,,Italian,
lumai,Lumai,Tim Weil,CEO,Oxford spinout co-founder.,British,
lumai,Lumai,Xianxin Guo,Head of Research,Oxford optical computing researcher.,Chinese,
lumana,Lumana,Sagi Ben Moshe,CEO,Former Intel Chief Incubation Officer and GM. Joined Intel via acquisition of his 3D Imaging company. Was Intels most senior Israeli executive.,Israeli,
lumana,Lumana,Ron Kimmel,CSO,Professor. Former senior role at Intel Israel.,Israeli,
lumana,Lumana,Ofir Mulla,CTO,Former senior role at Intel Israel.,Israeli,
lumia-security,Lumia Security,Omri Iluz,CEO,Founded PerimeterX (acq 2022). 25 years cybersecurity.,Israeli,
lumia-security,Lumia Security,Bobi Gilburd,CTO,Former Colonel IDF Unit 8200. CISO Israeli Intelligence.,Israeli,
luminal-ai,Luminal Ai,Unknown,Co-Founder,YC S25 batch.,,
luminance,Luminance,Adam Guthrie,Founder / Chief Technical Architect,Cambridge-based AI researcher,British,
luminance,Luminance,Dr. Graham Sills,Founder / Director of AI,Cambridge-based AI researcher,British,
luminance,Luminance,Dr. Mike Lynch (deceased),Original seed investor and early backer,Founder of Autonomy (acquired by HP for $11B); died in yacht accident in August 2024,British,
lyte,Lyte,Alexander Shpunt,CEO & Co-Founder,Co-founded and served as CTO of PrimeSense (acquired by Apple in 2013 for ~$350M). Key architect of Apple's depth-sensing platform including Face ID. Led depth sensing at Apple for a decade.,Israeli,
lyte,Lyte,Arman Hajati,Co-Founder,"Former Apple engineer, key architect behind Apple's depth-sensing and perception technologies.",American,
lyte,Lyte,Yuval Gerson,Co-Founder,"Former Apple engineer, key architect behind Apple's depth-sensing and perception technologies.",Israeli,
mage-ai,Mage Ai,Tommy Dang,CEO,Former Airbnb engineer. Headed marketing and promotions platform.,,
mage-ai,Mage Ai,Xiaoyou Wang,Co-founder,Co-founded Mage AI.,,
magic,Magic,Eric Steinberger,Co-founder & CEO,"Born in Vienna, Austria. Obsessed with AI from age 14. Studied Computer Science at University of Cambridge (2018-2020). Researcher in Deep Reinforcement Learning at Facebook AI Research (FAIR) from 2019-2022, where he collaborated with Noam Brown on poker AI (PokerRL). Founded ClimateScience, a climate education nonprofit. Left Cambridge and FAIR in 2022 to start Magic.",Austrian,
magic,Magic,Sebastian De Ro,Co-founder & CTO,"Holds a Master's degree in Computer Science. Previously at Google Research, specializing in large-scale machine learning systems. Co-founded two AI startups in Europe focused on NLP. Expertise in neural architecture design, distributed systems, and AI safety.",German,
magicschool-ai,Magicschool Ai,Adeel Khan,Founder & CEO,"Former teacher, assistant principal, principal, and district administrator in public schools",South Asian,
mai-marketing,Mai Marketing,Yuchen Wu,CEO,BS from Tsinghua University. PhD from Northwestern. Engineering Director at Google (2010-2020). VP of Engineering at Instacart.,Chinese-American,
mai-marketing,Mai Marketing,Jian Wang,CTO,PhD ML from UC Santa Cruz. Sr. Staff Engineer at Google Ads.,Chinese-American,
maieutic-semi,Maieutic Semi,Gireesh Rajendran,CEO & Co-Founder,"Founded Steradian Semiconductors (imaging radar, acquired by Renesas Electronics 2022). Team collectively holds 70+ patents. Products shipped over 1 billion units globally. Deep domain expertise in semiconductor innovation.",Indian,
maieutic-semi,Maieutic Semi,Ashish Lachhwani,Co-Founder & Chief Business Officer,Co-founded Steradian Semiconductors with Rajendran and Kumar (acquired by Renesas 2022). Extensive background in semiconductor design and AI systems.,Indian,
maieutic-semi,Maieutic Semi,Rakesh Kumar,Co-Founder & Chief Product Officer,Co-founded Steradian Semiconductors with Rajendran and Lachhwani (acquired by Renesas 2022). Background in semiconductor design.,Indian,
maihem,Maihem,Max Ahrens,CEO & Co-Founder,"PhD/Postdoc NLP Oxford, McKinsey",German,
maihem,Maihem,Eduardo Candela,CTO & Co-Founder,"PhD AI Safety Imperial College, MSc MIT, Tesla",Spanish,
mainframe,Mainframe,Jordan Singer,Founder & CEO,"CS degree from University of Arizona. 14 years building consumer products. Founded Diagram (one of earliest AI design tools, acquired by Figma). Product Designer at Figma. Previously shaped product at Cash App/Square. Design engineering background.",American,
majestic-labs,Majestic Labs,Ofer Shacham,CEO,Sold Chip Genesis to Google. Head of Silicon at Google GChips. VP/Head of FAST at Meta Reality Labs. 120+ patents.,Israeli,
majestic-labs,Majestic Labs,Sha Rabii,President,"Led Google silicon team, then Meta FAST.",Iranian-American,
majestic-labs,Majestic Labs,Masumi Reynders,COO,"Ex-Google, Meta FAST teams.",Japanese-American,
mako,Mako,Waleed Atallah,Co-Founder & CEO,Cornell Tech faculty-led startup,Middle Eastern,
mako,Mako,Mohamed Abdelfattah,Co-Founder,Cornell Tech,Egyptian,
mako,Mako,Lukasz Dudziak,Co-Founder,,Polish,
mal-bank,Mal Bank,Abdallah Abu-Sheikh,CEO,Serial fintech entrepreneur,Arab/Jordanian,
manas-ai,Manas Ai,Siddhartha Mukherjee,CEO,Pulitzer Prize oncologist. Columbia professor. Author Emperor of All Maladies.,Indian-American (Bengali),
manas-ai,Manas Ai,Reid Hoffman,Co-founder,Co-founder of LinkedIn. Partner Greylock.,American,
mandolin-ai,Mandolin Ai,Will Yin,Co-Founder & CEO,Repeat entrepreneur with background in healthcare,Chinese,
mandolin-ai,Mandolin Ai,Rohit Rustagi,Co-Founder & COO,Repeat entrepreneur,Indian,
manus-ai,Manus Ai,Xiao Hong (萧弘),Co-founder & CEO,"Details not widely reported; first startup launched in 2016, one year after graduation Founded first startup in 2016 building creator tools for WeChat. Founded Butterfly Effect in 2022, which launched Monica (a browser extension AI assistant) before pivoting to Manus.",Chinese,
manus-ai,Manus Ai,"Ji Yichao (季逸超), known as ""Peak""",Co-founder & Chief Scientist,"Beijing Information Science and Technology University (dropped out) Built ""Mammoth Browser"" (猛犸浏览器) at age 17, which became the most downloaded third-party iPhone browser in China. Later built Magi, a knowledge search engine. Named to MIT Technology Review's Innovators Under 35 (2025). Age ~32.",Chinese,
manus-ai,Manus Ai,Zhang Tao (张涛),Co-founder & CPO (Product),Chongqing University of Posts and Telecommunications Former Head of Global Product at ByteDance (2022-2023). Previously product manager at Tencent. Directed the Manus launch video.,Chinese,
marqvision,Marqvision,Mark Lee,Co-Founder & CEO,"Harvard Economics (Magna Cum Laude), Harvard Law School JD. Former McKinsey consultant. Former product lead at Honestfund.",Korean-American,
marqvision,Marqvision,DK Lee,Co-Founder & CBO,,Korean,
marr-labs,Marr Labs,Han Shu,Co-Founder,"Co-created Vlingo, the speech tech that powered Siri and Samsung's S-Voice (acquired for $225M)",Chinese,
marr-labs,Marr Labs,Dave Grannan,Co-Founder,Co-created Vlingo (acquired for $225M); serial entrepreneur in speech technology,American,
marvelx,Marvelx,Ali el Hassouni,Founder & CEO,Former Head of Data & AI at bunq (neobank unicorn); PhD in AI from Vrije Universiteit Amsterdam,Moroccan-Dutch,
mastra,Mastra,Abhi Aiyer,Co-Founder & CTO,"Principal engineer at Netlify, led 100+ person engineering org. Built Gatsby Cloud infrastructure (tens of thousands of build nodes, billions of files, hundreds of TB monthly). Previously co-built Gatsby for ~8 years.",American,
mastra,Mastra,Sam Bhagwat,Co-Founder & CEO,"Stanford graduate (2011). Co-founded Gatsby.js (open-source React framework, scaled to $5M ARR, sold to Netlify). Previously engineer at Zenefits (W13) and Plangrid (W12). Spent ~8 years building Gatsby.",American,
mastra,Mastra,Shane Thomas,Co-Founder & CPO,Staff engineer and head of product at Gatsby. 15+ years in open source. Previously built Audiofeed (AI podcasting app). State wrestling champion. All three co-founders built Gatsby together before Netlify.,American,
mate-security,Mate Security,Asaf Wiener,CEO,Former product leader at Wiz and Microsoft. First Wiz alumnus to found startup.,Israeli,
matters-ai,Matters Ai,Keshava Murthy,Co-Founder & CEO,"BE in Computer Science from Visvesvaraya Technological University. Founding engineer at Observe.AI (helped scale from seed to unicorn, building systems handling sensitive data at global scale). Leadership roles at major tech companies in data integration, knowledge graphs, and intelligent automation.",Indian,
matters-ai,Matters Ai,Harsh Sahu,Co-Founder & CTO,Founding engineer at Observe.AI (unicorn AI platform for enterprise contact centers). Built and secured enterprise-scale AI systems handling sensitive data. Co-founded Matters.AI in 2022 in Bengaluru.,Indian,
matx,Matx,Reiner Pope,Co-Founder & CEO,Led AI software development for Google TPUs; Efficiency Lead for Google PaLM; 10+ years in high-performance software and hardware,American,
matx,Matx,Mike Gunter,Co-Founder & CTO,28 years in hardware architecture; Chief Architect for Google ML chips; Architect for Google TPUs,American,
maven,Maven,Jonathan Corbin,Co-Founder & CEO,Former HubSpot executive. Deep experience in enterprise SaaS and customer experience platforms.,American,
maven,Maven,Sami Shalabi,Co-Founder & CTO,Former Google engineer. Technical expertise in AI systems and enterprise infrastructure.,Arab-American,
maven,Maven,Eugene Mann,Co-Founder & CPO,Former Stripe executive. Product leadership experience across enterprise platforms.,American,
maxim,Maxim,Vaibhavi Gangwar,Co-Founder & CEO,Former Google and Milaap. MBA in Entrepreneurship and Business Analytics from The Wharton School (2018-2020).,Indian,
maxim,Maxim,Akshay Deo,Co-Founder & CTO,"Former Postman, Slack, and Media.Net engineer. Previously founded AppSurfer and BetaCraft. Deep expertise in developer tools and API platforms.",Indian,
maxiq,Maxiq,Sonny Aulakh,Founder & CEO,"20+ years in tech. BS in Engineering from Cal State Sacramento. VP Products/Solutions/Vertical Marketing at Pure Storage. Global VP Sales Engineering at Dell EMC. VP Sales Engineering at EMC (XtremIO, $1B in first 18 months). Held roles at Reputation.com, Zscaler, Cisco, and Rainfinity.",Indian-American,
maxiq,Maxiq,Sunny Rai,Co-Founder & Head of Operations,Co-founded MaxIQ in 2022. Leads operations for the AI-powered customer journey management platform.,Indian,
megvii,Megvii,Yin Qi,CEO,Tsinghua University. Co-founded Megvii at age 25.,Chinese,
megvii,Megvii,Tang Wenbin,CTO,Tsinghua University. Led development of Face++ platform.,Chinese,
megvii,Megvii,Yang Mu,CTO (now departed),Tsinghua University. Early Face++ development.,Chinese,
mem0,Mem0,Taranjeet Singh,Co-Founder & CEO,"First growth engineer at Khatabook (YC S18), quickly became Senior PM. Started career at Paytm (India's PayPal). Built AI-powered tutoring app featured at Google I/O. Co-created EvalAI (open-source Kaggle alternative, 1.6K GitHub stars). Created first GPT app store (1M+ users).",Indian,
mem0,Mem0,Deshraj Yadav,Co-Founder & CTO,"Led AI Platform at Tesla Autopilot (large-scale training, model evaluation, monitoring for full self-driving). MS from Georgia Tech where he created EvalAI as thesis. Published at CVPR, ECCV, AAAI. Broadly interested in AI/ML infrastructure.",Indian,
mercor,Mercor,Brendan Foody,CEO,"Georgetown University (dropped out, sophomore year)",American,
mercor,Mercor,Adarsh Hiremath,CTO,"Harvard University (dropped out, sophomore year)",Indian-American,
mercor,Mercor,Surya Midha,Board Chairman (formerly COO),"Georgetown University (dropped out, sophomore year)",Indian-American,
merge-labs,Merge Labs,Sam Altman,Co-founder,CEO of OpenAI,American (Jewish heritage),
merge-labs,Merge Labs,Alex Blania,Co-founder,Tools for Humanity,German,
merge-labs,Merge Labs,Mikhail Shapiro,Co-founder,Caltech researcher,Russian-American,
metax-gpu,Metax Gpu,Chen Weiliang,Chairman,,Chinese,
metax-gpu,Metax Gpu,Peng Li,Co-CTO,AMD veteran,Chinese,
midjourney,Midjourney,David Holz,Founder & CEO,Co-founded Leap Motion; studied applied math at UNC Chapel Hill (left PhD); contracted for NASA Langley; neuroscience research at Max Planck Institute,American,
milestone-ai,Milestone Ai,Liad Elidan,Co-Founder & CEO,Met co-founder at Trinity College Dublin; focus on measuring software development efficiency,Israeli,
milestone-ai,Milestone Ai,Stephen Barrett,Co-Founder & CTO,Professor at Trinity College Dublin; research in software development efficiency,Irish,
mind-robotics,Mind Robotics,RJ Scaringe,Founder & Chairman (also CEO of Rivian),"Founded Rivian in 2009. PhD in Engineering from MIT Sloan Automotive Lab. Built Rivian into a publicly traded EV company (IPO 2021, one of the largest in US history). Deep experience in vertically integrated hardware manufacturing, supply chains, and factory operations. Serves as chairman of Mind Robotics while remaining CEO of Rivian.",American,
mindoo,Mindoo,Gauthier Willemse,CEO,"MD from KU Leuven, surgeon, MPH Harvard",Belgian,
mindoo,Mindoo,Bart Lens,CTO,"Ex-senior engineer at DataCamp, founding engineer at Conveo",Belgian,
mindsdb,Mindsdb,Jorge Torres,Co-Founder & CEO,MS in Information Systems from Australian National University (ML focus). Cambridge graduate. Ex-management consultant at Deloitte. Second dev at CouchSurfing (scaled to 4M users). Senior Engineer at Skillshare. CTO at Real Life Analytics. Visiting scholar at UC Berkeley (ML automation). Worked with Aneesh Chopra (first US government CTO).,Latin American,
mindsdb,Mindsdb,Adam Carrigan,Co-Founder & COO,Australian National University and University of Queensland graduate. Management Consultant at Deloitte. Dissertation at University of Cambridge on NLP for equity pricing prediction. Co-released initial MindsDB code in 2018 inspired by Iain M. Banks' Culture series.,Australian,
minimal-ai,Minimal Ai,Niek Hogenboom,Co-Founder,YC S25 batch.,Dutch (inferred from name),
minimal-ai,Minimal Ai,Titus Ex,Co-Founder,YC S25 batch.,Dutch (inferred from name),
minimax,Minimax,Yan Junjie (闫俊杰),CEO & Chairman,Former VP & Deputy Head of Research at SenseTime; PhD from Chinese Academy of Sciences; postdoc at Tsinghua University,Chinese,
minimax,Minimax,Zhou Yucong,"Executive Director, Visual Model Research & Engineering Lead","Former SenseTime (2018-2019); former Huawei (2019-2022), focused on algorithms",Chinese,
minimax,Minimax,Yang Bin,Co-founder (listed as former co-founder in some sources),Veteran of China's AI scene,Chinese,
minimax,Minimax,Yun Yeyi,COO,Former SenseTime employee,Chinese,
mintlify,Mintlify,Han Wang,Co-Founder & CEO,Software engineer by trade; previously worked on developer tools and infrastructure,American,
mintlify,Mintlify,Hahnbee Lee,Co-Founder,Software engineer by trade; experience in developer tools and product development,Korean-American,
mirador-therapeutics,Mirador Therapeutics,Mark McKenna,CEO,Former Prometheus Biosciences executive.,,
mirelo-ai,Mirelo Ai,CJ Simon-Gabriel,Co-Founder & CEO,"PhD in machine learning and causal inference from Max Planck Institute (under Bernhard Scholkopf). Postdoc at ETH Zurich. Former AWS Labs senior AI researcher. Degree in piano, organ and composition from Conservatoire in Strasbourg.",French,
mirelo-ai,Mirelo Ai,Florian Wenzel,Co-Founder & CTO,PhD in deep learning from Humboldt University. Former Google Brain researcher. Former AWS Labs. Musician who plays electric guitar in a Berlin electro band.,German,
mistral-ai,Mistral Ai,Arthur Mensch,CEO,"Ecole Polytechnique (2011); Telecom Paris; MSc Mathematics, Vision, Learning - Universite Paris-Saclay; PhD Machine Learning - Universite Paris-Saclay DeepMind (Google) - ~3 years",French,
mistral-ai,Mistral Ai,Guillaume Lample,Chief Scientist,Ecole Polytechnique; Carnegie Mellon University Meta AI (FAIR) - 2014-2023; co-creator of LLaMA,French,
